content,emoji,comment,current,time
"['[TÌNH NGUYỆN ĐÔNG MÙA GIÓ ẤM 2024] CUỘC HÀNH TRÌNH ĐẾN XỨ SỞ BĂNG GIÁ\n Jingle bell, jingle bell…\nKhi tiếng nhạc mùa Giáng Sinh vang lên, khi gió đông ùa về cũng là lúc ông già Noel lắng nghe những tâm nguyện. Hãy để Suctre’s Santa giúp bạn biến những lời cầu mong ấy thành sự thật nhé!\n Xin giới thiệu dịch vụ vận chuyển “yêu thương” đêm Noel - hoạt động gây quỹ cuối cùng cho chuyến xe Tình Nguyện Đông “Mùa Gió Ấm 2024” đã nổ máy. Khi đến với dịch vụ của Nhà Trẻ, các bạn TNV sẽ vào vai ông già Noel giúp gửi gắm những món quà ý nghĩa cùng tâm tư tình cảm đến với những người thân yêu, bạn bè và cả bản thân bạn. Những điều tuyệt đẹp sẽ không dừng lại ở đó, khi bạn ủng hộ dịch vụ của Nhà Trẻ chúng mình thì bạn đã chung tay đóng góp cho hành trình của chuyến xe tình nguyện lần này rồi đấy!\n Chúc bạn và gia đình một mùa Giáng sinh an lành, hạnh phúc và có những giây phút thật đáng nhớ. Đừng quên theo dõi fanpage để cập nhật những thông tin mới nhất về dịch vụ giao quà Noel gây quỹ của chúng mình nhé. Merry Christmas! \n---------------------------------------------------------------\n#CLBSTKT #MGA2024 #CHTDXSBG #thn #Linn']","['Tất cả, 211', 'Thích, 117', 'Yêu thích, 90', 'Thương thương, 3', 'Wow, 1']","['Đi thuiiii mng ưii', 'Ước ông già noel phát ngiu cho', 'Ông già noel nào sẽ may mắn được tặng quà cho tui', 'Ngọc Nhi công nghiệp dz', 'Võ Thị Đức Hạnh Lộ quá hả c', 'Năm nay mình siêu ngoan ước gì được ông già Noel tặng quà', 'Tuyệt vời lunnnnnj', '', 'háo hức gặp ông già noel qáaaa', 'Chờ được gặp ông già Noel', 'Đợi ông già noel đc 1 năm rùi', 'mê mê', 'Toi muốn làm bà già Noel', 'Thanh Hoa đã cap màn hình :)))', 'cho em 10 ông', 'Vũ Thùy Dương tham lam quá hà', 'năm nay có ông già nào rước tui di giao quà khom taaaa', 'Võ Thị Đức Hạnh có bà zà được hemm', 'Thao Chi ước thảo chi đặt ông già noel cho tui', 'Lin Châu qua trạm lựa liền', 'Ước được phát chục ông già Noel', 'Quỳnh Phạm t đặt boyfr thì m có giao quà ko', 'Tống Cẩm Quỳnh ok nhiệm vụ mới của ông già noel', 'Quỳnh Phạm ko phải m giao hà', 'Tống Cẩm Quỳnh thì t giao còn ông già noel là quà', 'Quỳnh Phạm dễ sợ cái icon :))', 'Khánhh Nghĩa giờ đổi qua Quỳn Giao còn kịp không', 'Nguyễn Thị Lan Phương hông eim', 'Nguyễn Thị Lan Phương chứ tưởng mún qua Quân Trí', 'Khánhh Nghĩa hay tưởng quá he :))', 'Huyền Trang ey vẫn lạnh mà\nngồi quấn mền nè', 'Kiều Nhi có tớ đây rùi hahhaaha', 'Kitty House Danang']",28859,"Thứ Tư, 20 Tháng 12, 2023 lúc 19:59",33
"['[TÌNH NGUYỆN ĐÔNG MÙA GIÓ ẤM 2024] VỎ BỌC MỚI NAY ĐÃ CỨNG CÁP HƠN\nVậy là hành trình Thu gom ve chai gây quỹ cho chiến dịch Tình Nguyện Đông “Mùa Gió Ấm 2024” đã chính thức khép lại sau nhiều ngày diễn ra. Những hạt giống mà các bạn Tình nguyện viên gieo trồng đã sắp ra hoa kết quả rồi, hãy luôn vững vàng vượt qua khó khăn để đi đến cuối chặng đường nhé!\nTrong suốt những ngày hoạt động dù thời tiết có đôi chút không thuận lợi nhưng các bạn Tình nguyện viên đã luôn cố gắng hết mình để hoàn thành nhiệm vụ. Với tinh thần không ngại khó khăn và đầy nhiệt huyết, các Tình nguyện viên Nhà Trẻ luôn muốn mang đến các em nhỏ vùng sâu vùng xa một mùa đông thật ấm áp và đầy ắp những tiếng cười.\nHoạt động Thu gom ve chai không chỉ giúp cho đường phố xanh-sạch-đẹp hơn, mà nó còn góp phần làm cho vỏ bọc mới của những chiếc bong bóng xà phòng thêm cứng cáp và đưa các em nhỏ đến gần hơn với ước mơ của mình. Thật ý nghĩa đúng không nào?\nBây giờ cùng chúng mình xem lại những bức ảnh đáng yêu và ý nghĩa trong suốt những ngày qua nhé!\nLink ảnh full HD: https://bom.so/hoatdongvechai\n—------------------------------------------------------------------------\n#CLBSTKT #MGA2024 #Vechai #Trang #TeamPhoto', '+11']","['Tất cả, 210', 'Thích, 148', 'Yêu thích, 59', 'Thương thương, 3']","['mê những hình ảnh ý nghĩa này', 'Phạm Hương bé ni ngoan quá tar', 'Nguyễn Thị Lan Phương đương nhin gòi', 'Phạm Hương iu team 10 qá i', 'Quỳnh Phạm mà ghéc riêng mỗi Tống Cẩm Quỳnh', 'Phạm Hương hắn âm mưu làm gián điệp team 10 á', 'Phạm Hương do b đó ghéc t trước íi', 'Tống Cẩm Quỳnh shao người nỡ Phạm Quỳnh', 'Quỳnh Phạm do m xàm ***', 'Tống Cẩm Quỳnh tớ làm cái khác chớ làm gián điệp đou cậuuu', 'Quỳnh Phạm ôk lần này t lợi dụng m', 'Iu quá', 'Hoài niệm quáaa']",29820,"Thứ Ba, 19 Tháng 12, 2023 lúc 20:04",13
"['[TÌNH NGUYỆN ĐÔNG MÙA GIÓ ẤM 2024] NHỮNG ""NGƯỜI HÙNG VE CHAI""\n Trong mỗi chúng ta chắc ai cũng đều rất quen thuộc với từ “ve chai” đúng không nào? Khi nói về ve chai, hẳn ta sẽ nghĩ ngay đến những chiếc chai nhựa, lon nước,... đã sử dụng qua, chẳng còn công dụng gì nữa và chỉ chờ đợi để được vứt đi hoặc được thu mua lại mà thôi! Thế nhưng bạn có biết rằng ve chai lại chính là nhân tố rất quan trọng giúp cho “bong bóng xà phòng” của Nhà Trẻ trở nên cứng cáp và vững chắc hơn không nhỉ?\n Việc thu gom ve chai mang lại rất nhiều lợi ích cho môi trường mà có thể bạn chưa biết đấy! Không chỉ bảo vệ môi trường, giảm số lượng bãi rác và diện tích mà còn nâng cao thu nhập giải quyết việc làm,... Thực sự đáng kinh ngạc vì ve chai thì nhỏ nhưng sức mạnh của chúng lại không nhỏ chút nào. Ve chai còn giúp mọi người thấy được nụ cười và niềm vui của những đứa trẻ, giúp cho lớp vỏ của “bong bóng xà phòng” trở nên cứng cáp hơn, ước mơ của những đứa trẻ kia cũng sẽ đến gần với tầm tay chúng hơn!\n Nào bây giờ hãy cùng chúng mình xem câu chuyện cảm động về những “người hùng ve chai” ở bên dưới nhé!\n------------------------------------------------------------\n#CLBSTKT #MGA2024 #VeChai #Hiln  #Tuongvy', '0:02 / 0:45']","['Tất cả, 303', 'Thích, 238', 'Yêu thích, 62', 'Thương thương, 3']","['', 'Nhân văn quá ạ', 'Mí bạn ni dễ thương quá', 'Đáng iu', 'Vy Tường Nguyễn Hồ Tường Nguyên video hay, mê người edit video', 'Khánh Ly mê bé Nguyễn Tường Vy', 'Xem xong mình cảm động quá', 'Xuất sắc quá ạ Nguyễn Tường Vy', 'đa tạ tỷ tỷ đã giúp đỡ', 'Muê dáng vẻ của chỉ khi quay video Nguyễn Tường Vy', 'Nó hơi ấy xíu xiu thoai c', 'Thành quả 4h sáng\nTường Vy', 'Top 1 cách để có đôi mắt']",30913,"Thứ bảy, 16 Tháng 12, 2023 lúc 20:12",13
"['[TÌNH NGUYỆN ĐÔNG MÙA GIÓ ẤM 2024] THƯ NGỎ\n “Mùa Gió Ấm” là chương trình thiện nguyện thường niên do CLB Sức Trẻ Kinh Tế - trực thuộc Hội sinh viên Trường Đại học Kinh tế - Đại học Đà Nẵng tổ chức. Với mục tiêu đóng góp một phần nhiệt huyết của mình để mang đến cho bà con vùng sâu vùng xa một chút ấm áp giữa cái lạnh mùa đông. Đồng thời là cầu nối giúp sự quan tâm của của các mạnh thường quân đến được với những mảnh đời còn kém may mắn.\n Chiến dịch Tình nguyện đông “Mùa Gió Ấm 2024” sẽ dừng chân tại xã Jơ-Ngay, huyện Đông Giang, tỉnh Quảng Nam. Đây là địa điểm còn gặp nhiều khó khăn, đời sống vật chất của người dân còn nhiều thiếu thốn. Sau khi ghé thăm, tìm hiểu và gặp gỡ trực tiếp, chúng tôi mong muốn tạo nên nhiều giá trị, mang đến một mùa đông ấm áp, ngập tràn tiếng cười cho người dân nơi đây. Đây cũng chính là ý nghĩa xuyên suốt chương trình mà BTC và các Tình nguyện viên thuộc CLB Sức Trẻ Kinh Tế đã theo đuổi từ những ngày đầu gây quỹ. \n Với mong muốn hỗ trợ, mang yêu thương đến những mảnh đời còn nhiều khó khăn, CLB Sức Trẻ Kinh tế hy vọng nhận được sự quan tâm, ủng hộ của Quý mạnh thường quân và các tấm lòng hảo tâm của mọi người.  \n CLB Sức Trẻ Kinh Tế xin chân thành cảm ơn!\n--------------------------------------------------------------------------------------\nChiến dịch Tình Nguyện Đông “Mùa Gió Ấm 2024”\n Địa điểm: Xã Jơ-Ngay, huyện Đông Giang, tỉnh Quảng Nam\n Thời gian tiếp nhận hỗ trợ: 16/12/2024 - 05/01/2024 \n Ủng hộ tiền mặt trực tiếp hoặc thông qua số tài khoản:\n         Ngân hàng BIDV\n         STK: 6211127096\n         Tên tài khoản: HO THI NGOC NHI\n         Nội dung chuyển khoản: [MGA2024] - [Họ và tên] - [Số điện thoại]\n Ủng hộ hiện vật: Lương thực, thực phẩm, nhu yếu phẩm, đồ dùng học tập, sách vở…\n--------------------------------------------------------------------------------------\n#CLBSTKT #MGA2024 #ThuNgo #Nấm #GB']","['Tất cả, 655', 'Thích, 489', 'Yêu thích, 154', 'Thương thương, 12']","['', 'Mong nhận được nhiều sự ủng hộ từ mọi người', 'Cảm ơn mọi người rấc nhìuuuu', 'được gồi đi thôiii', 'tuyệt vời ông mặt trời', 'Mong nhận được sự giúp đỡ của mạnh thường quân ạ', '', 'Mong nhận được nhiều sự ủng hộ từ mọi người', 'Thật ý nghĩaaaa', '', 'Lan tỏa yêu thương cùng ""Nhà Trẻ""', 'Trao yêu thương, nhận hạnh phúc', '', '', 'Rất mong nhận được sự giúp đỡ và ủng hộ từ các cá nhân/ tổ chức và các nhà tài trợ ạ', 'Rất mong nhận được sự giúp đỡ của các cá nhân/tổ chức và các nhà tài trợ ạ', '', 'Rất mong nhận được sự giúp đỡ và ủng hộ từ mọi người ạ', '<3333333333', 'Xem thêm 36 bình luận', '50/86']",31950,"Thứ Sáu, 15 Tháng 12, 2023 lúc 20:02",21
[],[],[],33229,
"['GÕ CỬA MÙA THI - RƯỚC A VỀ NHÀ\nCốc, cốc, cốc,...\nKỳ thi đã gõ cửa và đây là thời điểm để thể hiện tất cả những kiến thức đã tích lũy trong một học kỳ vừa qua.\n Vậy là sau bao tháng học hành, chạy deadline ở thư viện đến quán cafe thì kỳ thi kết thúc học phần cũng đã đến, chắc hẳn bây giờ các bạn đang rất hồi hộp và lo lắng nhỉ? Hãy vững tin trước mọi khó khăn, chinh phục mọi thách thức với niềm tin vào bản thân, cố gắng hết mình, học tập thông minh và giữ vững tinh thần lạc quan bạn nhé!\n Ngày mai các bạn 46K, 47K, 48K sẽ chính thức bước vào kỳ thi quan trọng này, đừng để những chướng ngại vật cản bước bạn đến với thành công. Hãy thư giãn, giữ tinh thần thoải mái để đạt kết quả cao nhất. Và cuối cùng, đừng quên rằng bạn không đơn độc, có gia đình, bạn bè, và cả Nhà Trẻ chúng mình - những người đang cổ vũ và ủng hộ bạn đấy!\n Chúc các sĩ tử Nhà Trẻ thi tốt, tỏa sáng, ẵm A về tay. Hãy tin vào bản thân, trong lòng chưa có “Ai” đó nhưng trong bảng điểm sẽ có A. Go, go, go! \n-----------------------------------------------\n#CLBSTKT #thitot #thn #Ynhi']","['Tất cả, 193', 'Thích, 101', 'Yêu thích, 89', 'Thương thương, 2', 'Haha, 1']","['E chúc mấy ac thi tốt nhe', 'Chúc mọi người thi tốt ạ', 'Okee ạ huhuhu', 'Nước tới nách chưa ạ?\nTới cổ thì kêu e nha ad', 'NT Huyền Trâm okie e', 'Phương Lê ôn thi cùng Ngọc Lan nè', 'Nguyễn Phước Lâm chạy TNĐ thoai', 'Ngọc Lan ai chạy đou biết', 'Phương Lê ple bận rộn =))) Hoàngle rủ ăn chè bù kìa', 'Tìm bạn đi học bài cùng', 'Thao Chi tìm xong r có học ko', 'Tống Cẩm Quỳnh thâm quá 2', 'Vũ Thùy Dương ôk mô đừng nói v mak', 'Tống Cẩm Quỳnh Vũ Thùy Dương kím bạn đi ngồi nhìn nhau cười cũmg đc nè', 'Thao Chi sợ tiếng sét ái tình', 'Thao Chi nếch guých', 'Ôn thi tới đâu rùi mng ơiiii', 'Ngọc Lan chưa ôn chữ mô', 'Võ Thanh Tú học đi you ơiuii', 'Ngọc Lan nửa chữ cũng chưa', 'Quang Phát ri là theo đi yêu rồi, ngày mô cũng dắt em ra z6 mà nới ri đỏ', 'Ngọc Lan nói ri ngta quánh giá tui thì chet dở', 'Ngọc Lan răng m kh chụp ảnh gửi t', 'Võ Thanh Tú tao có video', 'Quang Phát xạo', 'Cíu em cíu em ôn mãi hong thuộc']",34263,"Thứ Ba, 12 Tháng 12, 2023 lúc 19:56",26
