content,emoji,comment,current,time,comments_size
"['Đệm sám hối, dành cho mấy đứa mỏ hỗ.n, ngồi lên để tịnh tâm, thanh lọc tinh thần, bớt hít drama :))']","['Tất cả, 101', 'Haha, 58', 'Thích, 40', 'Buồn, 2', 'Yêu thích, 1']","['Nguyen Nhat Linh mua', 'Ôn Đình Oai kìa', 'Cái này cho Nguyễn Bích Ngọc khum biết có giảm đc xíu nào khumm ha Hiền Trần Nguyễn Thị Bích Ngọc :)))', 'Nguyễn Tấn Phương chơi ngải nó đi, chừng nào nó hết nói là hết nghiệp chứ ba cái món này 0 ăn thua', 'Nguyễn Tấn Phương hong biết đệm có chịu đc iẻm khum', 'Nguyễn Thị Bích Ngọc Hiền Trần hỏi dị thôi chớ biết cái này chịu j nổi nó:)))', 'Nguyễn Ngọc Hiền 2 chữ trong sạch thần thiếp nói cx đã chán ròi', 'Tuyết Ly đích thị dành cho chúng ta ><', 'Chế Nguyệt Phượng', 'Tôi ko hề nghiệp!!!', 'Bảo Ngọc mua liền =))', 'Trần Thu Hà có hỗn mô mà mua', 'Yến Hoàng', 'Quynh Anh dạ', 'Yến Hoàng kp tặng m, m có nghĩ đến bạn đó giống t kh', 'Quynh Anh giống lắm...', 'Trịnh Hân mua cho tui 1 cái đi', 'Hồ Quốc Đạt cái nư của bạn thì có đi tu cũng ko hết đâuuuuuu', 'em cần cái này ạ Nhung Nhung', 'Nana Ng mua 7 cái để xài đủ tuần nha em', 'Nhung Nhung kh lẽ kao nghiệp ts mức z', 'Nana Ng cho tịnh tâm í mà', 'Hiểu Linh đặt liền cho chụy chục cái', 'Ngọc Thơ hợp lý nha', 'Phuong Quach', 'Le Thi Khanh Hien ê', 'Thùy Dung bớt', 'Nguyễn Thị Lệ QuyênThảo LyNguyễn Thảo My', 'Hồ Thị Thu Thảo tui là tui tịnh tâm lắm á ngăn', 'Nguyễn Thảo My thôi được r', 'Ngoc Loan công cụ bớt nghiệp nì :vv od lẹ đi', 'Võ Thị Phương Bin m chớ khum phải t :))))', 'Ngoc Loan chắc t nghiệp 1 mình :))', 'Cái đệm ngồi của tui cũng vừa lúc bị xẹp :))', 'Nguyễn Thùy Sang kìa', 'Huynh Huong đợi t săn sale dề cho ngồi', 'Thi Thi 2 mình sắm cho Nguyễn Trí Minh Chiến một cái đii youu', 'Thanh Thảo cái ni oke nè', 'Thanh Thảo chi rk chờiii. Tôii sống tốt mà đâu hỗn đâu khẩu nghiệp dới aiiii', 'Nguyễn Trí Minh Chiến ko có hỗn hả Thi Thi', 'Thanh Thảo thôi chê nha', 'Ly Na em mua 100c đi em', 'Kim Hà để t lên t chửi m cho đã ha gì', 'Lười Nói màu gu\nmàu dzía', '288 Ngũ Hành Sơn Qiao Store - Phụ Kiện Và Quà Tặng. Mời các bạn tham khảo phụ kiện và quà tặng ở đây ạ', 'Thuý Hiền mua cặp hân chớ mỏ hỗn hoàiii', 'Thảo Nguyễn ụa\nsao thống nhất để cho cô', 'Thuý Hiền t thiết nghĩ tụi mình hợp hơn tại mk nghiệp', 'Thương Thương Nguyễn chuẩn lun mày ơi', 'Phạm Tấn Phát cho m', 'Tặng đứa bạn ở đây nè :))) https://shope.ee/9KIcsW1SBk', 'Ôn Nguyễn Kiều Oanh tịnh k nỗi']",121783,"Chủ Nhật, 31 Tháng 12, 2023 lúc 20:06",52.0
"['#2737\nTâm thư gửi nhà trường!\nKính chào trường Kinh tế trọng điểm miền Trung yếu dấu của em!\nEm đã rất mong ngóng vào trường từ những ngày ngồi học trên ghế cấp 3. Và em cũng đã được học và gắn bó với mái trường DUE của mình gần 2 năm. Tuy em chưa viết confession bao giờ, nhưng lần này, em mong DUE confessions gửi tâm thư này của em đến trường với ạ!\nThứ nhất, Nhà trường có thể tâm lý trong việc sắp xếp lịch thi một cách tối ưu và thông minh hơn được không ạ? Sao trường có thể xếp 2-3 môn chung 1 ngày được hay vậy ạ. Đặc biệt là xếp 2 môn đại cương học bài chung 1 buổi nữa: Lịch sử Đảng+Kinh tế chính trị. Em biết là trường mình toàn những giáo viên giỏi nên là sẽ nghĩ 2 môn này dễ và bình thường. Chứ tụi em thì không giỏi đâu ạ! Em sắp nhập viện vì 2 môn này chung buổi đấy ạ. Chưa kể việc xếp lịch liên tiếp nhau những môn ngành. Em phát ốm luôn ấy ạ. \nThứ hai, em nghĩ môn nào thì nên thi chung 1 lần hoặc 1 buổi thôi ạ, vì đề có sự phân hóa khác nhau giữa 2 ca thi hoặc ca sáng và ca chiều độ khó- dễ khác nhau rất nhiều. Đề ca 1 sáng dễ hơn rất nhiều so với những ca khác. Vả lại, các bạn thi về rồi ns đề cho nhau. Điều này hoàn toàn không công bằng chút nào. Nên em nghĩ trường lần sau nên để môn nào thì thi chung 1 buổi, hoặc 1 ca thôi ạ. \nEm mong trường suy nghĩ lại và thiết kế lịch thi hợp lí và đẹp hơn ở những kì sau nhé trường. Em yêu trường rất nhiều, nên chỉ có 1 bài viết bức xúc nhẹ nhẹ dị thuiiii ấy ạ. Mong trường đừng có chửi em \n---------\n#muối\n---------------------------------------\n Gửi về page câu chuyện của bạn tại đây: bit.ly/2Uxhm9L']","['Tất cả, 159', 'Thích, 109', 'Haha, 29', 'Buồn, 18', 'Yêu thích, 2', 'Thương thương, 1']","['Thứ nhất, Nhà trường không xếp 2-3 môn một ngày chứ không lẽ xếp mỗi môn một ngày, thế thì đến bao giờ mới thi xong? Rõ ràng là hai môn khác nhau, này là do bạn đăng ký 2 môn này và xui thay trúng thi cũng một ngày chứ đâu phải lỗi tại nhà trường\n. Với lại học là cả quá trình 4 tháng, nhà trường cho thêm 2 tuần để ôn lại kiến thức cả kỳ chứ có phải 2 tuần để lấy lại gốc đâu. Việc nhà trường phân lịch thi cũng có sắp xếp chứ có phải ưa phân cái gì thì phân cái đó đâu bạn.\nThứ hai, mình nghĩ đề chắc cũng khá tương đương nhau chứ không đến nỗi dễ hơn rất nhiều so với ca khác đâu, ví dụ bạn ôn đề tủ và trúng đề tủ thì thấy nó dễ vì bạn đã từng làm qua rồi. Hoặc có thể đề bạn trúng cái bạn chưa ôn tới thì nó khó, còn đề kia bạn biết thì nó lại thành dễ.', 'có lịch thi trước cả tuần mà nói chi lạ rứa hè', '5 hôm thi 7 môn tự luận vẫn ổn mà', 'Nguyễn Tuấn Hùng idol nó phải khác', 'Nguyễn Thị Hoàng Trà kỳ này chim cook rồi chị ơi', 'Đăng ký ít môn thôi, cho đời dễ thở', 'Nghe sợ ma', 'Lâm Ngân đề 1 mà lạ z', 'Linh Le làm mừng hụt', 'Võ Quỳnh Như m viết đúng khong=))', 'Trần Thị Minh Nguyệt sắp đc thi chung 2 môn', 'Phương Phạm Nguyen Tra My rén dần đi là vừa :(((', 'Trần Thị Minh Nguyệt tẩu hỏa nhập ma :(((', 'Bùi Yến Nhi hên k đki lsđ + ktct heheh', 'ai xu thì chịu', 'HÀNG MỚI NHÀ DaNa Food\nSỉ giỏ già chỉ từ #99k _____ 99k\n#99k\nKho hàng tết giá cực cực tốt - KHÔNG QUA TRUNG GIAN\n- Hũ pet- zip - hàng tết mẫu mã đa dạng\nTỔNG KHO HÀNG TẾT 2024 - HẠT DINH DƯỠNG DANAFOOD\nĐặt hàng vui lòng liên hệ:\nFacebook : Huyền Thành Đạt\nĐT : 0901 995 899\nKho hàng tại :219 Chu Huy Mân - Sơn Trà - Đà Nẵng', '', '0:00', '/', '0:15', 'Quất 7 môn trong 6 ngày liên tiếp, nice', 'Ai rồi cũng nói này nói nọ trường thôi\n@ Trần Kỳ Phong Nguyễn Thị Phương Linh Hoàng Vy', 'Lý Như tự nhin tag dô cho họ biết mình nói trường', 'Nguyễn Thị Phương Linh đang tag dô cho đọc mà nhờ mài ngta mới bít mình chửi trường á', 'Lý Như ụa, là giao phậy', 'Lý Như gì m iu trường thí moẹ', 'Ngay câu chào đã biết được độ thâm thuy của em', 'Ngân Hà Nghe nói bạn nào đó thi 12 môn trong kì mà vẫn được 11A và 1B+, nể thật!!!', 'nào thi 8 môn vấn đáp trong 5 ngày rùi tính ạ', 'Cố gắng thi nha các bạn yêu']",122886,"Chủ Nhật, 31 Tháng 12, 2023 lúc 20:00",30.0
"['#2737\nCâu chuyện nộp bằng Tiếng Anh ở trường!!!\nMình cảm thấy rằng trường mình cứ sao sao trong việc nộp bằng tiếng Anh để pass học phần cho 48K ấy mọi người ạ.\nThời gian nộp bằng cứ ngắn và gần như tụi mình không thể thu xếp được lịch thi để nộp kịp bằng ấy. Hic hic.\nMình thật sự muốn pass học phần để đỡ tiền và tốn tg học mà vì thi không kịp trong những ngày đầu tháng 12 mà bay tiền để phải nộp 5 tín. Mình quyết tâm thi ngày 21 tháng 12, lúc đấy vừa cấn thi học kì, vừa phải thi TOEIC mình còn phải cay thêm việc nộp tiền 5 tín chỉ và chờ đến đợt sau để nộp bằng ấy mn. \nSao trường không thu xếp để sinh viên đỡ tốn tiền ấy nhỉ???\nMình cảm thấy Tiếng Anh nên để sinh viên 1 khoảng thời gian dài dài tí để pass!!!\nMong trường đọc được điều này và suy nghĩ sắp xếp lại giúp tụi em. \n---------\n#muối\n---------------------------------------\n Gửi về page câu chuyện của bạn tại đây: bit.ly/2Uxhm9L']","['Tất cả, 123', 'Thích, 88', 'Buồn, 29', 'Haha, 4', 'Yêu thích, 1', 'Wow, 1']","['Không phải tự nhiên mà trường mình là trường ""Kinh tế"" đâu', 'Quỳnh Nhi tư bản mà đúng hem Nguyễn Ngọc :))))', 'Nguyễn Bích Ngọc dí hộc hơi ko kịp thở', ""Quỳnh Nhi thì đúng với chữ 'kinh tế' mà"", 'Ủa em trường mình tên gì\ncái chuyện thu tiền ở due em còn lạ sao', 'trễ 5 ngày là mất 3 chiệu thoi ko có buồn', 'Anh Thi khókkk nhìu', 'Thanh Tú nói thay lòng mình roài', '""kinh tế"" mà', 'Xưa đến giờ vậy mà chứ riêng 48K đâu, khóa 47k đợt hè vừa rồi ra lịch nộp trong hè luôn mà :)))) t phải bắt xe ra ĐN lên trường để nộp đó trời quơi.', 'Thảo ViPhan Thảo', 'Trương Nguyễn Thục Uyên có người đã nói dc nỗi lòng', 'Phan Thảo cúi cùng cũng có người hỉu', 'Trương Nguyễn Thục Uyên truong lon', 'Phạm Bích Tâm ê nỗi lòng', 'Phạm Thị Ngọc k lường đc', 'Quỳnh Mai', 'Hồng Ngân buồn mà hỏng dám nói', 'Quỳnh Yên =))))', 'Quỳnh Phạm ê đúng ý mình lun á', 'Hà Nhi Jerry Trinh còn lạ sao', 'Võ Huỳnh Hoài Châu lên lịch ôn thi đi:))', 'Mai Thương nhỏ này hong biết kh được hủy mà điện lên bị la nè', 'Nhung Trương bọn anh kinh tế, nhưng bọn anh chơi hỏng tinh tế', 'Mỹ Tâm rồi nó hủy cho cô chưa', 'Dương Đông Phương ai viết rồi nì, đúng là tư bản', 'Hoàng Dung t tưởng m viết luôn á', 'Dương Đông Phương Gia Linh cũng gửi cho kao kkk', 'chung nổi niềm với chủ tus', 'Dương Đông Phương ê t đọc t cũng tưởng nó viết luôn Á ee', 'Phùng Thị Thúy Mai bây ơi t viết là không có mong trường đâu, là due *, trường *, biết z *** kkk', 'bởi ""kê tính"" mà', 'Đáng lẽ em phải tự tìm hiểu bằng nhiều cách để biết rõ những quy định về việc nộp bằng để pass TA này và cố gắng thu xếp có được bằng từ trước khi vào học kì 1 năm 2 rồi. Chứ cứ đợi có thông báo rồi mới chuẩn bị thì sao cho kịp. Đại học mà em, đâu phải lúc nào thầy cô cũng cầm tay chỉ điểm cho em từng cái đâu, em phải chủ động tìm hiểu trong mấy việc ni vì rõ ràng nếu có việc chi xảy ra thì người bị thiệt chỉ có em thôi\nthôi thì chúc em may mắn những lần sau trong những vấn đề khác', 'Ôn Nguyễn Kiều Oanh em cảm ơn lời khuyên của chị nha', 'Lê Nguyễn Kiều Oanh kê elm :>', 'Hzzz', 'ai soạn văn cho Huỳnh Huyền đăng bài đây', 'Thu Hiền tao giấu kĩ lắm mà m cũng biết là sao con', 'Lê Thảo m up hã???', 'Nguyễn Khánh Linh khum chỉ mình tôi cay']",123487,"Chủ Nhật, 31 Tháng 12, 2023 lúc 19:00",40.0
"['#2736\nTÌNH NGƯỜI PHÒNG THI QUÁ LẠNH LẼO\nCác bạn đã bao giờ chưa???\nBạn đã bao giờ nằm trong cái trường hợp là bị bạn bè “thân thiết” với chính mình chơi xấu đến mức mà bản thân của mình cảm thấy tổn thương vô cùng hay chưa???. Tuy nói bạn bè thì có lúc giúp được sẽ giúp, nhưng cx đừng tệ tới mức lơ nhau khi cần thiết chứ. Nhưng sống ở đời đâu ai giấu mãi được cái cách sống lỗi và đố kị nhau của đứa bạn mình tin tưởng cơ chứ… \nChuyện là cùng học ôn thi Lịch sử Đảng, với đứa bạn “kha khá thân”, chơi tầm 7 năm gòi, từ vc chung ngành, chung lớp (but chưa chung pồ hoiiii). Nó có tài liệu để học mà nghĩ sao mình hỏi nó chả trả lời, nó đi share cho “troai”. Trai hỏi thì nó gửi, còn mình hỏi nó bảo chả biết, thôi thì “hên xui”. Ủa sao kì vậy??? Có tài liệu gì ta cũng share mi mà, ren m kì cục rứa??? Ganh đua học bổng hà??? T có học bổng đâu mà ganhhhhh.\nChưa hết, vào thi chung phòng với nó, nó làm xong trước 20 phút, mà giám thị coi cũng không quá khó, mà mình gọi nó “ lờ ơ lơ”. Sạo kì vậy “bạn”???? Kiểu mình thất vọng vì hai chữ bạn bè lắm luôn ấy!!! Bạn với chả bè!!!\nRồi về mới xin lỗi… Ủa gì xin lỗi… Có được tác dụng gì không!\nSao cái hồi share bài cho trai kkhoong nhớ bạn mình, sao cái hồi lơ lớ trong phòng thi cũng quên luôn bạn mình. Xin lỗi chi nữa==))\n---------\n#muối\n---------------------------------------\n Gửi về page câu chuyện của bạn tại đây: bit.ly/2Uxhm9L']","['Tất cả, 325', 'Haha, 168', 'Thích, 129', 'Buồn, 26', 'Thương thương, 1', 'Wow, 1']","['tổng kết cuối năm 2023 với 4 chữ: ""Có híu với troai""', 'Minh Potter tệ vậy con', 'Như Quỳnh honggg nha má toi nhắn dùm chủ tussss', 'Chơi với nhau 7 năm mà lên đây phốt thì cũng chả tốt đẹp gì, bạn không chịu học bài thì phải chấp nhận thôi chứ sao trách nó, nó có sống giùm c/s của bạn hông??\nBạn sợ nó không bày bạn, nó hơn điểm bạn đúng không? Thế thì bạn cũng đố kị đấy thôi.\nChẳng lẽ bạn cứ phụ thuộc vào nó, nó không share tài liệu là bạn không ôn đc à, không biết đi hỏi đứa khác à.\nĐọc mà tức á, hai đứa không ai vừa ai, dẹp nghỉ chơi mẹ đi.', 'Đinh Ngân tài liệu chắc là đề đó bạn\nthường ít người có đề năm ngoái, mà bạn chơi với nhau, đã hỏi rõ là có k rồi mà kiểu đó thì ?\nchủ tus nói rõ có tài liệu đều share có đứa bạn ""thân"" mà nó chơi z thì bức xúc bình thường chứ gì đâu ?', 'Đúc kết lại năm 2023 của nhỏ nì chính xác là “có hiếu với trai”', 'Có hại với bạn , có hiếu với trai', 'Diệu Hiền chớ bẹn muốn tui ren', 'Lee Thh Hieu mình đâu có biết đâu mà bàyy', 'Hiếu Hi đại hội đồng Quảng Trị', 'Nguyễn Công Hoàng ae hắn phải như thế\nGọn lẹ còn về nữa', 'Lê Cẩm Linh koi trừng', 'Khánh ChiNga Trương hên 2 con bé này còn có tình', 'Duy Hưng vô tình', 'Khánh Chi nói rứa năm mới vỡ mòm', 'Bạn thân là Thân ai nấy lo đó ạ. Tốt nhất không tin ai bạn nhé', 'Đặng Thị Hiền quen lắm nghe kk', 'Nguyễn Hạ Vi sống lỗi tý ak mà kk', 'Ngô Đức Hải em là ko có vậy rồi', 'Lê Thảo bn ni cũng ko share cho t nè, bạn ci kì cục', 'Văn Hòa có mà share cho m mà m không học :))', 'Hoàng Thị Mỹ Hạnh bạn Thảo chơi rứa là k dc, mang tiếng bạn hay chơi', 'Văn Hòa\nnhột quá', 'Hạnh Nguyễn có trai cx hổng đc lơ bạn nghe chưa', 'Võ Hân lơ là bay 3tr', 'Lê Thị Mỹ Linh, Thái Minh Châu, Minh Thư. Trước thi k có share tài liệu cho chị em mà chỉ có ăn ngủ 3 ngày 3 đêm với bài vở thôi...', 'hên qá bạn gánh mình Huongg Thuy', 'Lệ Quân chị ni cũng có híu với trai lắm', 'Bùi Ngọc Tĩnh yeah chính là toyyyy đok', 'Queo thi cử mà họ đâu có nghĩa vụ chỉ bạn, ai cũng có cơ hội như nhau k chịu học thì đi thôi:"")', 'Thành quả năm 2023, có hiếu với...', 'Mi phốt hả HoàngPhúc Đinh', 'Trần Thị Thuỷ Kiều mãi yêu Kiều', 'Hồng Trương cảm ơn ngtaa chưa', 'Trần Thị Vui hâhha em mà bỏ rơi thì em ko bị cái kết xém chết rr c', 'Lann Anhh hơi quen...', 'Anh Thư Thân ai nấy lo.', 'Thu Hà ren lơ teo', 'Nhật Hạ t chưa hỏi m thì thôi chớ :))', 'Quá tệ', 'HaPhuong Anh đọc xong cái tự nhiên thấy nhớ chồng', 'Nguyễn Dương Bảo Uy tạo y một mớ doc share e đó', 'HaPhuong Anh iu chồng', 'Nguyễn Thảo Linh xợ hok pà', 'Nguyễn Việt Hảo sợ lắm sợ lắm', 'Võ Thị Khánh Linh', 'NT Nghĩa nghĩa phốt linh đây chớ đâu', 'My My Nguyễn Bùi Trần Ny Sa Nguyễn Thanh Trần Nguyễn Khánh Tâm tự nhiên thấy bạn mình củn dễ hương, tốt bụng', 'Đoàn Quỳnh Anh nhưng bạn số 1 mk số 9', 'My My Nguyễn support tinh thần kk', 'Đoàn Quỳnh Anh lấy cụ khoai hoi', 'Bùi Trần Ny Sa 10 cụ lun', 'Hoàng Yến may ko có trai để có hiếu', 'Phương Linh Choo phải tag Thùy Trang zô', 'Hoàng Yến Tớ có 10 a lận', 'Thùy Trang rứa vẹ', 'Như Phương bỏ rơi chị em rứa m', 'Thuý Ngọc có tlieu up locket mà ko share cho bạn\nlẫyyy', 'Phạm Thị Hồng Thắm\ncó hiếu với zai quá', 'Nguyễn T. Thu Thảo quá tệ', 'Phạm Thị Hồng Thắm ce mình có nhau', 'Trúc Ly Nhắn ko rep tề\nCó rùi nà', 'Trần Hà nhìn nhau nhưng không biết làm :))', 'Ngô Thanh Trúc đôi bạn cùng lùi rồi chứ không như họ', 'Trần Ngọc Linh Giang ngôn ngữ giống của m quá voại =))', 'Ánh Nguyệt ủa lộ r hả', 'Trương Minh Quân tôi cảm ơn bạn', 'Trần Hạnh Nguyên xin lỗi bạn mình nhiều nhé, mình tệ bạc quá :))', 'Phạm Tấn Phát thôi hiểu rồi, nghỉ chơu', 'Trần Hạnh Nguyên unfr đi', 'Phương Thảo làm sai nhưng bày nhiệt tình thì có lỗi hongg', 'Nguyên có luôn =))))', 'Nguyên họ thì k có lỗi, nma m thì có', 'Phan Võ Thanh Tuyền iu bn nhất mỗi tội kh chung phòng thi:))))', 'Phạm Yến thấy iu bảo én lạ lùng', 'Như Ý Phan khác chỗ ngta xong trước 20ph, còn t vs m ngồi tới cuối giờ xong nhìn nhau khóc', 'Võ Lê Vân Khánh có nhỏ mô hiếu với trai dễ sợ', 'Cũng muốn được troai hỏi mà sao toàn đây Tran Khanh Vy hỏi vậy', 'Hằng Phan hết cơ hội đc hỏi ròi', 'Nguyễn Lê Diệu Anh gọi đc nhưng không ai biết làm', 'Thảo Vi m hả', 'Phan Thảo chị k có mê troai như Trương Nguyễn Thục Uyên', 'Thảo Vi haha xem lại tềnh chị em', 'Phan Thảo tình nồng thắm', 'Thảo Vi có cứt', 'Quốc Anh lỗi tu b', 'Phan Gia Tuệ bớt có hiếu với trai nhen chưa', 'Phan Xuân Triều m đăng phốt con kia đúng hok\nĐúng hok Tran Phuoc Anh', 'Thanh Kha có hiếu quá ik :vv', 'Phan Xuân Triều dừa lắm', 'Vy Lê tệ', 'Lê Thị Tường Vi bạn nên biết trân trọng mình đuy', 'mê ciu nên z ó', 'Xem thêm bình luận', '50/52', 'Có hiếu với trai quá bạn', 'Rồi thân dữ chưa ní', 'Đặng Thị Hiền kìa bạn =)))']",124060,"Chủ Nhật, 31 Tháng 12, 2023 lúc 17:30",98.0
"['#2735\nMình chào mọi người ạ. Hôm nay bọn mình vừa thi kết thúc học phần môn Thiêt Kế Truyền Thông Đa Phương Tiện của Cô Chu Mỹ Giang. Mặc dù một kì học với nhiều dealine và sự nghiêm ngặt của cô, tuy nhiên sau buổi báo cáo từ những lời dặn dò, tâm sự cho tới những dòng nhắn gửi của cô, mình thấy cảm động và ấm áp vô cùng vì vậy mới viết cfs này ạ.\nEm không phải là một leader của bất kì nhóm nào, tuy chưa có nhiều cơ hội được làm việc và tiếp xúc nhưng em cảm thấy cô rất tuyệt vời ạ. Em cảm ơn cô đã luôn nhiệt tình hướng dẫn, dành cho bọn em sự tận tâm và tình cảm. Chúc cô luôn mạnh khỏe, ngày một thành công hơn và dìu dắt nhiều thế hệ sinh viên hơn nữa. Yêu cô<3\nVà nếu có cơ hội, mình cũng rất recommend học môn học này tất cả các bạn!\n---------\n#muối\n---------------------------------------\n Gửi về page câu chuyện của bạn tại đây: bit.ly/2Uxhm9L']","['Tất cả, 266', 'Yêu thích, 132', 'Thích, 130', 'Haha, 2', 'Thương thương, 1', 'Buồn, 1']","['Ước ai cũng như cô', 'Ngọc Trâm hc cô ngủ ngon lun, m sợ gì hếch', 'Tiên Nguyễn ngủ hồi mô, mang tiếng', 'Đức Trãi cô dạy môn gì vậy ạ, để em tranh thủ đk', 'Hà Ngọc Phi Ước được gặp Cô', 'Trương Quang Hùng mong chờ', 'Cô Chu Mỹ Giang.', 'Dương Kim Ngọc mê cô quá đi hihi', 'Thao Thanh đọc tâm sự của cô xong tự nhiên thấy dl cũng ít, học cũng nhàn', 'Dương Kim Ngọc xứng đáng được học thêm kì nữa', 'Thao Thanh chưa có điểm đừng nói z gỡ lắm nha', 'Iu coi thật', 'quá là đáng iu luôn cô Chu Mỹ Giang', 'Nguyễn Văn Phôn', 'Nguyễn Thị Duyên tự hào ghê', 'Cô Giang 10 điểm không có nhưng Hồ Nữ Hằng Phi', 'Như chưa hc k bk hc r ms thấy mệt nhưng zui quạ', '+1 iu cô Giang', 'Nhả vía học cùng cô 3 môn', 'Phann Thị Thu Thơ thiết kế truyền thông đa phương tiện, công cụ truyền thông trực tuyết, marketing căn bản nha', 'học cô giang là bao chi tiết, xưa được nghe bạn cô đồn là mình cô gánh cả nhóm']",124597,"Chủ Nhật, 31 Tháng 12, 2023 lúc 15:58",21.0
['Ngày cuối cùng của năm 2023 rùiiiii\n\nMọi người còn điều gì hối tiếc khi chưa thực hiện được không nhỉ???'],"['Tất cả, 94', 'Thích, 77', 'Yêu thích, 9', 'Buồn, 6', 'Thương thương, 2']","['DUE Confessions ad giống mình quá', 'Chưa có xog deadline', 'Như Quỳnh Ai rồi cũng phải chạy deadline', 'Như Quỳnh lẹ lẹ lên Quỳnh ơi', 'Nguyễn Quỳnh Như xog hồi trưa r chụy oiii', 'Hữu Bằng thoi mà', 'Chưa học bằng lái xe', 'Ước qua môn', 'Vẫn chưa học đủ', 'Chưa hiểu được tâm lý của nàng', 'Chưa tiết kiệm tiền', '-Chưa học được gì như mong đợi ạ', 'Chưa hiểu giáo trình nói cái gì', 'lỡ vạ mồm tí thôi mà căng quá :((((', 'Trúc Quỳnh nghỉ nhìu mà hok dc full A bùn', 'Ad trước nhe: Chưa cóa pồ...=))', 'Chưa học được nhiều']",125134,"Chủ Nhật, 31 Tháng 12, 2023 lúc 10:00",17.0
