content,emoji,comment,current,time,comments_size
"['#2820\n""Xin chào các bạn nữ DUE,\nNhân ngày 8/3 mình chúc các bạn nữ luôn vui tươi, chúc cho thế giới này mãi xinh đẹp như các bạn.\nTối nay bạn nữ nào chưa có người yêu hay mới chia tay đừng ngần ngại thả TYM cho mình nhé. Hy vọng chúng ta hữu duyên, hy vọng 8/3 năm sau thế giới bớt đi 2 người cô đơn.\np/s: Mình thuộc thế hệ 9X, người ĐN nhé !\nYêu các bạn !""\n---------\n#xíu \n---------------------------------------\n Gửi về page câu chuyện của bạn tại đây: bit.ly/2Uxhm9L']","['Tất cả, 192', 'Thích, 106', 'Haha, 47', 'Yêu thích, 37', 'Thương thương, 1', 'Wow, 1']","['Yêu 1 bạn thôi chứ yêu các bạn là dở rồi :))', 'Thái Minh ChâuDiệu LinhLê Thị Mỹ Linh ý em sao', 'Lương Lyna nhanh còn kịp haha', 'hhaha trễ lâu rồi', 'Ly Na thả tim kìa', 'Nguyễn Thị Bình An e thả tim r ah', 'Trần Nguyễn Khánh Quỳnh anh có ngyeu r mà tag anh chi', 'Mẫn Đinh timmmm đyy', 'Nữ thì k có nhưng em có thằng bạn tên Giuse Anh Tú, nó sống trên đời 21 năm rồi nhưng chưa 1 lần được đi chơi 8/3, anh có thể dắt bạn em đi cho nó biết cảm giác được k ạ', 'Lê Mai Trúc Vy tym liền', 'My Phan còn c Lê Thủy nữa nè', 'Lê Mai Trúc Vy úi sao quên chỉ được', 'Lê Mai Trúc Vy My Phan =))) cảm mơn', 'người ĐN, 9X chưa có bồ =))) Nguyễn Lý Minh Trí anh viết đúng k', 'Đức Trãi nút thả tym bị liệt thông cảm', 'Thanh Huệ Tuyết Ngân Hồng Hiếu Hoàng Ân My Tam lên cho anh mấy con mã new bên e', 'Hoàng Trần Quỳnh Giang m đừng có reo ce như z nữa….', 'Tuyết Ngân như lời bài hát e chèn zô mà c', 'Giờ mình apply còn kịp không ạ?', 'Nãy bạn mình không có wifi đòi đăng ký 4G để thả tym, nói rứa thôi chứ tag Phan Ngọc Diệu vô thì lộ quá']",1106,"Thứ Sáu, 8 Tháng 3, 2024 lúc 22:21",20.0
"['#2819\n""|||Mọi người ơi, ai ở trọ mà sắm đồ nội thất như: Tủ lạnh, bàn,ghế,gương,…thì cẩn thận nha ạ|||\nChuyện là mới đây em vừa bị lừa Cọc tiền m, huhu. Em thấy nó đăng bài lên nhóm đồ cũ Đà Nẵng, em nhắm trúng tủ lạnh 1 cánh 120l mà zá chỉ 800k(còn rất mới). Ấy vậy là em liền ib để mua, trong đầu em chỉ nghĩ là tủ mới như vậy chắc nhiều ng hỏi mua nên em liền cọc để giữ hàng, ban đầu là 800k, em deal xuống 600k nó ok luôn mn ạ(lúc này em nghĩ em thông minh\n), xong nó bắt em cọc 1/2, em lại deal xuống cọc 100k vì còn là sinh viên\nvà em đợi nó ship đồ đến nhưng có cái nịt\nđm\nKết luận: THANH TOÁN KHI NHẬN HÀNG nha cả nhà iu. em đau lòng quá vì mình bị ngu(học kình tế mà ngu quá huhu ko tiếc tiền bị lừa mà tiếc tiền học Vi mô vĩ mô đồ đó\n), mn vào chửi em cho em tỉnh táo với,em cảm ơn mn!\n""\n---------\n#muối\n---------------------------------------\n Gửi về page câu chuyện của bạn tại đây: bit.ly/2Uxhm9L']","['Tất cả, 10', 'Thích, 8', 'Buồn, 2']","['Nguyen Phuong Linh chúng ta còn hên phải khum chị yêu', 'Nguyễn Thị Ngọc Aanh đần', 'Chờ sang ngày mai rồi chửi, nay 8/3 tạm tha']",1538,"Thứ Sáu, 8 Tháng 3, 2024 lúc 20:33",3.0
['Tâm trạng của ai đó khi đã cố dành xiền để mua quà tặng bạn gái 8/3 nhưng vẫn bị cô ấy giận vì không tâm lý...'],"['Tất cả, 86', 'Haha, 43', 'Thích, 37', 'Buồn, 5', 'Yêu thích, 1']","['Thanh Giang là cái hình ảnh ni làm m cười rậc rậc cả tiết học =))', 'Nguyễn Thị Ngọc Duyên nhưng mà nó mắc cười thật mà dm', 'Thanh Giang cái mặt m mới làm t mắc cười đm :((', 'Thỳ Duong giống em hôm qua nè chị iu', 'Bình Minh Hoàng t cx hiện đang như m ngày hum qua á con quể', 'Thỳ Duong phải sử dụng bùa thôi', '-)))', 'Mời bạn ghé qua MoonSun Store để xem bó hoa sứ kẹp tóc của bọn mình nhé. Vừa xinh lại vừa có thể làm phụ kiện cài tóc đáng yêu của các bạn gái nữa, món quà chân ái là đây chứ đâu. :33']",2046,"Thứ Sáu, 8 Tháng 3, 2024 lúc 17:31",8.0
"['#2818\n""Em viết cfs chỉ có một mong muốn nhỏ xíu gửi đến  thầy cô khoa L là thầy cô có thể cho khoá nào viết cfs chê đề dễ thì bắt khoá đó thi vấn đáp thôi được không ạ hoặc là cho khoá đó đi thì đừng mang văn bản pháp luật cũng đc \n. Còn em thấy đề thi như vậy là quá sức với em rồi em không thể cố sức mình làm được đề khó hơn được. Nên là em quỳ lạy van xin thầy cô đừng bắt em thi vấn đáp mà.\nCảm ơn ad đã duyệt \n""\n---------\n#Xíu\n---------------------------------------\n Gửi về page câu chuyện của bạn tại đây: bit.ly/2Uxhm9L']","['Tất cả, 132', 'Haha, 65', 'Thích, 54', 'Buồn, 11', 'Yêu thích, 1', 'Phẫn nộ, 1']","['Nếu em học K49 thì chuẩn bị thi vấn đáp thôi. Thi xong bị mê vấn đáp luôn, an tâm.', 'Xin được đồng cảm và chia sẻ với bạn qua ca khúc\n:\nhttps://youtu.be/qqnmuU_8bh8?si=0SivKCpEBGxke8E8', '[ĐỘ TA KHÔNG ĐỘ NÀNG] phiên bản Tân Bạch Nương Tử Truyền Kỳ 2019', 'Nguyễn Thế Đức lại là khoa L kìa a', 'Trần Thanh Nhã mang L di muon noi =))', 'Hứaa Phi', 'Thương Hà']",3398,"Thứ Năm, 7 Tháng 3, 2024 lúc 21:51",7.0
['Của ai lên trường nhận nè '],"['Tất cả, 290', 'Haha, 186', 'Thích, 60', 'Buồn, 43', 'Yêu thích, 1']","['Ad cfs này chúa vô duyên à ?', 'Cẩmm Nhung thề đ hiểu, mấy đợt duyệt mấy bài kiểu trap trap này kia là đã thấy kh thấm nỗi rồi.', 'Cẩmm Nhung đợt này a bầu em lên làm Ban Quản Trị Page nge Nhung kakaka', 'Tiên Minh bữa mới chỉ', 'Nguyễn Thị Bình An Mun, nó kìa', 'Trần Nguyễn Khánh Quỳnh quay tiktok hăng quá bị rơi mất', 'Hoàng Lê Trà My kêu nhỏ Bo lụm lại đi =))', 'Vy Phạm kkkk', 'Vy Phạm tàn ác quáa', 'Tố Quyên hôm bữa nè', 'Nguyễn Lương Ánh Ngọc e nói c cất đi khum chịu, cứ hay làm rớt quá', 'Tố Quyên chê', 'Thanh Hoài từ bữa đến h ko ai lụm', 'Minh Ánh rớt kìa cha', 'Hằng Bé gúm', 'Nguyễn Đức Tuấn', 'Phuong Linh lụm', 'của Dong Uyen Tran Ho', 'Ngân Bùi cha m', 'Quang Anh rớt kìa', 'N. K.Thảoo =)))))', 'Xuânn Thịnh lượm đi cậu :)))', 'Xuânn Thịnh m tag lỡ ngta hỉu lầm t làm rớt', 'Mĩ Kiều phải m k t đi ngang qua thấy mấy lần lun', 'Bích Huệ nói nhỏ thoi để mai t lên lụm', 'Lth Hạnh lên rồi kk', 'Lê Thị Thúy Thu chịu luôn r cuối cùng nó cũng đc lên', 'Hiền Diệu họ chụp lại đc ròi kìa', 'Phan Thị Quỳnh Như dỡn mặt hả', 'Trần Hà Thư Phan Quỳnh Lan Anh thứ hôm bữa t hỏi m nèk', 'Hồ Đăng Gia Phúc đừng biết nhé', 'Trọng Khánh Rớt kìa', 'Sy Tran hèn gì nó trống trống', 'Phươngg Thảoo Dương Tuyết Nhi :)))', 'Nhi Anh hôm qua đá ra mà h lên cfs luôn', 'Nhi Nguyễn m tag z họ tưởng t rớt', 'Nhi Anh :))))) chắc khom đao', 'Thanh Ngân tag chị em dô lượm kìa', 'Nguyễn Trịnh Yến Nhi em có thấy chị Thảo Hiền ghé trường tối qua phải chăng là…', 'Thanh Ngân hqua thấy mà tính mang về cho mấy ce đó chớ', 'Nguyễn Trịnh Yến Nhi Tôi đã thấy chị em nhà họ tag nhau mà k tag tôi', 'Bao Pham rau câu', 'Quý Thành kêu Linh Thư lên nhặt lại dùm cái, dị quá', 'Trần Thị Thu Quý ủa cái đó cuae b mà', 'Quý Thành t có sài cái này bao h đâu', 'Trần Thị Thu Quý tại có ấy đâu mà xài', 'Quý Thành chúng ta như nhau', 'Thùy Trang nhớ bữa sáng định mệnh đó.', 'Chi Bé Thao Vy Hồng Phúc Hà Khôi nãy cười dữ quá rớt đây chi nữa', 'Hoàng Mai m mà', 'Võ Thị Thùy Dương haha Mỹ Nhật', 'Đã lộ rồi mà k lo giữ là răng rứa Lê Minh hè. Rớt hoài luôn á', 'Vy Dieu Ly', 'Ha Ni ra nhận hàng m', 'Vy Dieu Ly của mi t đà dán dú đây vẫn đủ', 'Bae Dalmore hen la day khg mg', 'Babies Bie hahahh sazzz', 'Qỳnh Như chi hay rứa con', 'Diep Khanh Nguyen rớt quài z má', 'Thảo Vyy zu ziên', 'Kẻ hay làm rớt chắc chắn là mày Su Tran', 'Nguyễn Khánh Ngọc của em kìa :))', 'Duy Hoàng dị quá Hai ơi lên lụm đi hai', 'Nguyên Trần ủa nó ở đó lâu vậy cơ à', 'Trúc Quỳnh chứ chi rớt tùm lum ri b', '@@', 'Nguyễn Minh Sương chi z, của MS à', 'Phan Thị Hoài Quyên hồi chiều t mới chỉ mđ', 'Mỹ Nhật to rứa hả', 'Nguyễn Khiêm hồi trưa đi học Võ Thị Thùy Dương kêu của Hoai Thu đó m', 'Mỹ Nhật hong phải, Võ Thị Thùy Dương kêu của Võ Thị Thùy Dương đó :)))', 'Võ Thị Thùy Dương bắt em phải nói là của Mỹ Nhật', 'Hoai Thu khonggg Mỹ Nhật nói của Mỹ Nhật', 'không phải của Võ Thị Thùy Dương Mỹ Nhật Hoai Thu, vậy của ai, của Nguyễn Khiêm', 'Hoai Thu Võ Thị Thùy Dương Mỹ Nhật 3 người sài chung mà chừ rớt đi đổ thừa tui', 'Nguyen Bao Phuong rớt đây nè bà, làm tìm chiều chừ', 'Lê Ngọc Cường nhỏ quá ko sài loại này được', 'xin lỗi mn nhiều là thằng bạn e Lê Văn Toại làm rơi ai nhặt đc thì cho thằng bạn em xin lại ạ', 'Vũ Hoàng bố thằng ngáo này lo học hành cho qua môn đi em', 'Lê Văn Toại tầm ni học bổng rồi em ơi', 'iPhone CHÍNH HÃNG giá 9,99 đến 20,39 triệu\n○ iPhone 15 Series từ 20,39 triệu\n○ iPhone 14 Series từ 17,09 triệu\n○ iPhone 13 Series từ 14,49 triệu\n○ iPhone 12 Series từ 12,09 triệu\n○ iPhone 11 Series từ 9,99 triệu\nĐỦ BỘ TỪ IPHONE 11 ĐẾN 15\nMua ngay: https://bit.ly/FPTShop2024_iPhone\nC h ỉ F P T S h o p m ớ i c ó:\nBẢO HÀNH 2 NĂM\n𝓚𝓱𝓸̂𝓷𝓰 𝓵𝓸 𝓻𝓸̛́𝓽 𝓰𝓲𝓪́\n____\n#FPTShop #iPhone15 #FPTShopStory', 'Nguyễn Bảo Trâm Diệu Hoàng miếng dán mụng', 'Thuy Ngan của m à', 'Nguyen Khanh Linh mụn của t to hơn', 'Thuy Ngan này cỡ mụn cóc mụn trâu =)))', 'ai gớt thì qua sốp mình tặng cho cái quần nè', 'Nhi phải con đâu:(']",4035,"Thứ Năm, 7 Tháng 3, 2024 lúc 16:25",87.0
['Có thể bạn chưa biết\n\n8/3=2\n8-3=5\n8.3=24'],"['Tất cả, 70', 'Haha, 46', 'Thích, 22', 'Yêu thích, 1', 'Buồn, 1']","['Ai dạy ad 8/3=2 thế', 'Nguyễn Thịnh đúng rồi chứ gì nữa? trong code C# thì 8/3 = 2 (phép chia lấy số nguyên) còn 8%3 = 2 (phép chia lấy số dư)', 'Phương Thảo Lê Quỳnh Như', '""Mồng 8 tháng 3""=em ra thăm vườn, chọn 1 cành hoa xinh tươi tặng cô giáo']",5055,"Thứ Năm, 7 Tháng 3, 2024 lúc 15:30",4.0
"['[HTTT] TIA CHỚP LÓE NGANG - Ý TƯỞNG BỪNG SÁNG\n Thể lệ cuộc thi: http://tinyurl.com/thelecuocthisr2024 \n Hồ sơ đăng ký dự thi: http://tinyurl.com/hosodangkysr2024 \n Link đăng ký: http://tinyurl.com/formdangkysr2024 \n Thời gian đăng ký: Từ ngày 22/01/2024 đến ngày 10/3/2024\n----------------------------------\nGiữa không trung sâu thẳm kia, một tia chớp lóe lên báo hiệu một điều bất ngờ đã xuất hiện. Tại lúc này, Startup Runway chính thức rẽ sóng, mở ra một chuyến phiêu lưu mới đầy những điều thú vị. Bạn đã sẵn sàng để bước vào đó chưa?   \nThời khắc quan trọng đã đến, Cuộc thi Startup Runway 2024 xin thông báo MỞ ĐƠN ĐĂNG KÝ Ý TƯỞNG. Trở lại vô cùng ấn tượng với mùa thi thứ VIII, Cuộc thi rất mong chờ những sáng kiến độc đáo đến từ các bạn trẻ từ cấp Trung học Phổ thông đến Đại học trên khắp mọi miền đất nước. Với chủ đề mới lạ nhưng đầy tính thời đại “Toward a New Era: Empowering Sustainable Entrepreneurship”, Startup Runway 2024 hy vọng sẽ trở thành đại dương rộng lớn để các nhà khởi nghiệp trẻ có thể thỏa sức vẫy vùng, cho ra đời những ý tưởng kinh doanh hữu ích cho xã hội.\nNhững vấn đề về môi trường, xã hội vẫn luôn là mối quan tâm hàng đầu của nhân loại. Là thế hệ trẻ, chúng ta cần tạo ra được những mô hình nhằm giải quyết bài toán cân bằng giữa lợi nhuận và sự phát triển bền vững của xã hội. Startup Runway 2024 tin rằng, chủ đề này sẽ tạo nên bàn đạp vững vàng, giúp các đội thi vươn xa hơn trên con đường khởi nghiệp của chính mình.\nCác bạn đã sẵn sàng để tạo nên những cơn sóng ngầm mạnh mẽ trong năm nay chưa? Hãy bắt đầu hành trình của mình và cùng Startup Runway 2024 kiến tạo nên một kỷ nguyên bền vững nhé!\n----------------------------------\nMọi thắc mắc xin vui lòng liên hệ:\n Số điện thoại: 0932947161 (Đàm Trung Việt)\n0961907152 (Hồ Phan Anh Thư)\n Email: startuprunway2024@startuprunwaydue.com\n Fanpage: Startup Runway DUE\n Group: Cộng Đồng Kết Nối Ý Tưởng Khởi Nghiệp\n Địa chỉ: Văn phòng Đoàn Thanh niên - Hội Sinh viên - Phòng A101, Trường Đại học Kinh tế - ĐHĐN.\n#Startup #runway2024 #startuprunway #DUE #TowardaNewEra #EmpoweringSustainableEntrepreneurship']","['Tất cả, 44', 'Yêu thích, 26', 'Thích, 16', 'Thương thương, 2']","['', 'ui xịn thía', 'Hoàng Ngân bẹc rê ngày ni ns đúng', 'Quá là tuỵtt', 'Còn 3 thoai áaaaaa\nKịp kịp kịp apply', 'Tấn Đức tgia dc cơ cấu ko ní', 'Nguyễn Trần Hồng Hải đc em ơi cơ cấu cho mí anh đẹp dai luôn ý chứ', 'Nhật Lê tin chuẩn chưa để đi đồn', 'Võ Thị Kim Ngân không chuẩn sao mà được']",5763,"Thứ Năm, 7 Tháng 3, 2024 lúc 10:00",9.0
"['#2817\nCó ai từng bị ra rìa vì thái độ chưa ? \nBị quăng cục lơ khi hỏi chuyện bạn bè. Bị á khẩu vì người khác xen ngang, cắt lời. Bị xem như tàng hình trong lớp \nMình biết mình bị ghét. Ghét vì thái độ vô tri, vô cảm. Giờ đến cả những gì mình nói họ cũng ko tin. Đến cả những bài đăng trên confession về lớp 48k## lại nghĩ là mình ghi \n Mình biết lớp chỉ mong bình an, vui tươi nên né mình ra. \nThừa nhận là mình đã sai vì năm đầu ham làm thêm nên đùn đẩy, chậm trễ trong làm nhóm và chủ quan ko kiểm tra mà đăng kí trùng đề tài nhóm khác... Là leader mà kéo điểm cả nhóm xuống \n Nhưng giờ mình chỉ muốn học để tốt nghiệp thôi. Mình chả có thái độ chi nữa hết, đặc biệt là không dám cười hay nói gì trong lớp luôn, chỉ cúi gằm ôm đt... Nhưng vẫn bị nghĩ xấu vì mấy cái tin trên confess \nĐã ko có kq mình còn bực bội, để bụng làm chi. Lớp cứ bình an, tươi cười không có mình cũng dc nhá. Thân ái \n Mong là nếu có gặp lại, mình có thể vô tư mà cười vì đã nỗ lực nhiều rồi \n---------\n#Chup\n---------------------------------------\n Gửi về page câu chuyện của bạn tại đây: bit.ly/2Uxhm9L']","['Tất cả, 95', 'Thích, 62', 'Buồn, 21', 'Yêu thích, 6', 'Haha, 3', 'Thương thương, 2', 'Wow, 1']","['cố lên bạn', 'Ừm', 'Là sao', 'Đức Trãi hong hiểu', 'Nhã Trân là z đó']",6734,"Thứ Tư, 6 Tháng 3, 2024 lúc 20:01",5.0
['Góc giải đáp thắc mắc và tìm infor'],"['Tất cả, 25', 'Thích, 21', 'Yêu thích, 2', 'Haha, 2']","['DUE Confessions quá hạn nộp thì ko nộp để pass đc nữa bạn', 'DUE Confessions nếu bằng đó đủ đk đầu ra thì ko cần nộp lại đâu', 'DUE Confessions Nếu có cơ hội thì chúng ta có thể gặp nhau ở Trung Tâm Ngoại Ngữ Big Step nha', 'Tham khảo thử bên TPHub á bé', 'DUE Confessions mình cx ko rõ, mà theo mình nghĩ là có', 'DUE Confessions không học quá 5% tổng số tín tối thiểu phải học là được', 'DUE Confessions ko bị nha, 5% chỉ tính học phần bị điểm F thôi á', 'DUE Confessions theo mình biết thì mình nộp ít tiền hp hơn chứ ko phải nhận tiền á', 'DUE Confessions 2h30 nha, tuần này mới học là 3h =)) có nhóm zalo nào học mấy h thầy thông báo', 'DUE Confessions .. ai có ib em với ạ', 'DUE Confessions xét từ trên xuống dưới theo thứ tự xuất sắc-> giỏi-> khá, ai GPA cao hơn thì đc ưu tiên hơn trong cùng mức hb á', 'DUE Confessions theo mình biết thì hè hiếm khi có lớp plđc lắm, bạn có thể đăng kí học cải thiện môn này ở học kì I, II cx đc á', 'Cho em hỏi phòng CTSV làm việc với sinh viên ngày thứ mấy ạ', 'Các bạn cho mình xin review thi Toeic Online trên máy tại trường zới đc hum ạaa', 'Dạ cho em hỏi ạ. Em có bằng pass tiếng anh mà đã vô học được vài buổi rồi. Thế có nộp để pass được không ạ. Em cảm ơn ạ', 'Em sinh viên Năm 2 đã nộp pass học phần TA vào năm 1 thì có cần nộp lại chứng chỉ TA để pass đầu ra trường không ạ?', 'Chào các ac ạ. Em là 49K và hiện tại em muốn bắt đầu học IELTS. Kiến thức nền của em cũng tạm ổn. Các ac có thể giới thiệu cho em thầy cô nào dạy chất lượng ( online hoặc offline) hay trung tâm nào ok không ạ', 'Dạ mọi người ơi cho e hỏi học cải thiện có bị hạ bằng không ạ', 'Dạ mn cho em hỏi, mình thuộc diện được giảm học phí (có người nhà bị tnlđ) chứ không phải hộ nghèo, hộ cận nghèo, mồ côi, thì mình sẽ được nhận tiền theo mỗi kỳ đúng không ạ? Mình có cần nộp lại các giấy tờ liên quan nào không ạ? Em cảm ơn ạ.', 'Thấy dự án Shopee Apprentice Program 2024 - Vietnam nên apply thử. Nhưng mà..... cái tên trường mình ko tìm thấy trong list của shopee. Ai thử đk rồi thì cho hỏi cách chọn với, hắn còn ko cho đánh tên mà phải chọn trong list', 'cho mình xin in4 bạn tóc xanh mullet quân sự lớp k21.04Due đại đội 4 vứi ạaa. Nhìn bạn ngầu vai dan', 'Mình là 49K đang học thực hành quân sự đợt 1, mình nhờ cfs và mọi người giúp mình tìm infor bạn nữ chân ngắn hát bài Vành khuyên nhỏ vào tối t4 giao luu văn nghệ của đại đội với ạ. Mình nể cột hơi của bạn cực, rap nghe cute hết sức', 'Chào mọi người, mình là 49K vừa học xong quân sự phần thực hành. Qua 2 tuần đi học mình ấn tượng rằng DUE có nhiều bạn nữ xinh thật. Nhưng gây ấn tượng nhất cho mình có lẽ là bạn nữ bí ẩn diện 1 bộ đồ đen hát rap bài Vành khuyên nhỏ vào buổi tối giao lưu văn nghệ của đại đội 5,6. Thấy bạn có vẻ ngại ngại mà lên nhạc là bạn nhún nhảy nhìn cute lắm. Hát xong bài là bạn với các bạn khác kéo nhau đi mất để lại mình còn ngẩn ngơ. Đến bước đường cùng mình lên đây nhờ cfs và mọi người giúp mình tìm infor của bạn ấy. Nếu may mắn cfs của mình được đăng lên và bạn thấy cfs thì hãy thả phẫn nộ nhé', 'Mình cần tìm infor 1 bạn nam ở đại đội 5 hoặc 6 vừa học xong phần thực hành quân sự của 49K đây. Hôm trước mình đi xuống cầu thang gặp bạn đang hát bài ""Trái đất ôm mặt trời"" thì mình có ham vui hát chêm vào, mà bạn cũng để cho mình hát chung lun. Mình cực kì ấn tượng với giọng hát của bạn và tha thiết muốn tìm infor của bạn.', 'Cho em hỏi có anh chị nào theo ngành digital marketing ko ạ, em muốn hỏi 1 kỳ sẽ có bao nhiêu tín chỉ ạ, chương trình TA của ngành đó có khó không, và sẵn đây cho em hỏi anh chị trường cótor chức thi ĐGNL không ạ và thời gian thi diễn ra khi nào và ở đâu ạ\nEm vẫn ở đây để chờ câu trl của anh chị, em xin cả ơn nhiều ạ', 'Có bạn nào học lớp cầu lông 07 không cho mình hỏi là mấy giờ vào học zị\nĐầu kì giờ thầy cho nghỉ miết giờ không biết học mấy giờ', 'em muốn tìm tài liệu : Luật kinh doanh (các văn bản luật), lịch sử đảng', 'ac nào cho e xin tí rv về ngành Kinh tế với ạ chuyên ngành nào cx đc ạa', 'Chào các ac ạ. Em hiện tại đang bắt đầu chập chững công tác viết CV và lấy nhiều chứng chỉ các thứ. Em đang muốn tìm 1 người thầy hoặc 1 người dẫn dắt để giúp em trong quá trình làm CV các thứ ạ. Ac nào có kinh nghiệm có thể giới thiệu giúp em được không ạ', 'Cho em hỏi là học bổng KKHT của trường mình xét như nào vậy ạ, tại em đọc trong danh sách học bổng KKHT năm ngoái thấy nhiều loại học bổng khác nhau . Em cảm ơn nhiều', 'Anh/chị đi trước cho em hỏi\nEm muốn học cải thiện môn pháp luật đại cương thì kỳ hè tới em đăng kí, nhưng mà lỡ như lớp không đủ sinh viên, bị trường huỷ lớp, mà em lại không thể tìm đủ nhiều các bạn sinh viên muốn học cải thiện giống em thì em phải làm sao ạ?']",7150,"Thứ Tư, 6 Tháng 3, 2024 lúc 19:00",31.0
