content,emoji,comment,current,time
"['[TUYỂN SINH ĐẠI HỌC CHÍNH QUY]\n KHÁM PHÁ NGÀNH HỌC 2024 \n Ngành QUẢN LÝ NHÀ NƯỚC \n Mã trường: 𝗗𝗗𝗤\n Mã ngành: 𝟳𝟯𝟭𝟬𝟮𝟬𝟮𝟱\n Phương thức tuyển sinh: http://due.udn.vn/vi-vn/tuvantuyensinh2024/gt/cid/5417\n---------------------------------------------------\n Khoa Lý luận chính trị Trường Đại học kinh tế - Đại học Đà Nẵng tự hào là đơn vị uy tín trong đào tạo Quản lý nhà nước, đơn vị hàng đầu trong giảng dạy các môn Lý luận chính trị trong toàn Đại học Đà Nẵng. Với đội ngũ giảng viên giàu kinh nghiệm, tận tình và gần gũi với sinh viên Chương trình đào tạo luôn được đổi mới, phù hợp với yêu cầu của thực tiễn, đáp ứng nhu cầu nguồn nhân lực trình độ cao của xã hội. Cùng một mục tiêu chung là đào tạo cử nhân ngành Quản lý nhà nước có năng lực chuyên môn kinh tế chính trị, hành chính để hoạt động nghề nghiệp trong cả 2 khu vực công và khu vực tư; có được đầy đủ các kỹ năng tin học, ngoại ngữ, giao tiếp hiệu quả, kỹ năng ứng dụng, kỹ năng mềm; tuân thủ các chuẩn mực xã hội, đạo đức nghề nghiệp và thực thi trách nhiệm với xã hội.\n Đến với mùa Tuyển sinh 2024 năm nay, hứa hẹn sẽ có thật nhiều điểm thú vị trong hoạt động Tuyển sinh. Quý phụ huynh và học sinh sẽ được giới thiệu những thông tin cần thiết và bổ ích nhất về môi trường học tập, chương trình đào tạo, hoạt động ngoại khóa, kỹ năng,...Nên hãy theo dõi chúng mình thường xuyên để cập nhật được những thông tin một cách kịp thời nhé! Đồng thời quý phụ huynh và học sinh cũng có thể liên hệ trực tiếp qua các kênh thông tin đã giới thiệu để được trao đổi thêm thông tin về Trường và ngành học nhé!\n---------------------------------------------------\n Thông tin liên hệ\n Website Khoa Lý luận chính trị: http://due.udn.vn/vi-vn/khoa/ly-luan-chinh-tri\n Fanpage LCĐ Lý luận chính trị: https://www.facebook.com/lcdkhoallct.due\n-------------\n Tham gia Tuyển sinh Đại học Kinh tế Đà Nẵng- DUE: www.fb.com/groups/tuyensinhddq để cập nhật thông tin tuyển sinh mới nhất!\n-------------\n CALL NOW \n 0911 223 777 - 02363 522345\nTruy cập: http://tuyensinh.due.udn.vn\n Inbox @Trường Đại học Kinh tế - Đại học Đà Nẵng (www.fb.com/FaceDUE) để được tư vấn, giải đáp thắc mắc\n-------------\n#DUE #tuyensinh #tuyensinh2024 #tuvantuyensinh #khampha #nganhhoc #quanlynhanuoc #hanhchinhcong #kinhtechinhtri']","['Tất cả, 26', 'Thích, 19', 'Yêu thích, 7']",[],1144,"Chủ Nhật, 10 Tháng 3, 2024 lúc 11:59"
['Trường Đại học Kinh tế - Đại học Đà Nẵng · Âm thanh gốc'],[],[],2620,"Thứ bảy, 9 Tháng 3, 2024 lúc 21:41"
"['[CHƯƠNG TRÌNH “TIẾP BƯỚC TRƯỜNG THI 2024” TẠI QUẢNG NGÃI]\n Cập bến Nhà văn hoá lao động tỉnh Quảng Ngãi vào chiều nay (9/3),  Chương trình “Tiếp bước trường thi 2024” sẽ đem đến nhiều thông tin bổ ích, thú vị cho học sinh THPT trên địa bàn tỉnh. Chương trình được trực tiếp trên Đài PT – TH Quảng Ngãi, Fanpage Kênh tuyển sinh hướng nghiệp: www.fb.com/tuyensinhhuongnghiep.vn, Youtube Kênh tuyển sinh hướng nghiệp: https://www.youtube.com/@KenhTuyenSinhHuongNghiep.\n Hiện diện tại chương trình, PGS.TS. Đoàn Ngọc Phi Anh – Phó Hiệu trưởng – Trường Đại học Kinh tế - Đại học Đà Nẵng đã giới thiệu các chương trình quốc tế của trường gồm chương trình cử nhân chính quy quốc tế của Trường với hình thức chuyển tiếp 2+2, 3+1 (thí sinh tham khảo tại: http://due.udn.vn/vi-vn/tuvantuyensinh2024/gt/cid/5422) và chương trình liên kết quốc tế: http://due.udn.vn/vi-vn/daotaoquocte. Ngoài ra, thí sinh còn có thể lựa chọn 02 chương trình chính quy được đào tạo hoàn toàn tiếng Anh gồm Marketing số và Kinh doanh quốc tế nếu đảm bảo chất lượng ngoại ngữ đầu vào. Sinh viên sau khi tốt nghiệp sẽ được cấp văn bằng theo quy định của Bộ GIáo dục & Đào tạo, trên Phụ lục văn bằng ghi rõ ngôn ngữ đào tạo là tiếng Anh.\n Chương trình cũng nhận được khá nhiều câu hỏi của thí sinh về các ngành Khoa học dữ liệu, Thương mại điện tử và Công nghệ tài chính của Nhà trường. PGS.TS. Đoàn Ngọc Phi Anh cho biết đây là các ngành mới của Nhà trường được các bạn học sinh ưu tiên lựa chọn trong các mùa tuyển sinh. Chương trình đào tạo của các ngành có sự kết hợp của lĩnh vực kinh tế, quản trị và kỹ thuật, bên cạnh sự tham gia của các doanh nghiệp trong việc xây dựng chương trình đào tạo, thực hành, thực tập, đào tạo nghiệp vụ. Sinh viên tốt nghiệp các ngành trên có cơ hội việc làm cao khi nhu cầu rất lớn về nguồn nhân lực trong bối cảnh bùng nổ công nghệ số hiện nay,\n Tại chương trình, đại diện Trường Đại học Kinh tế cũng giới thiệu các phương thức xét tuyển vào Trường và chia sẻ bí quyết chọn ngành đúng đắn trước ngưỡng cửa đại học. PGS.TS. Đoàn Ngọc Phi Anh nhắn nhủ thí sinh Quảng Ngãi hãy nỗ lực, quyết tâm trong kì thi tốt nghiệp THPT năm 2024 và trúng tuyển ngôi trường mơ ước. Thầy, cô giáo và các bạn sinh viên Trường Đại học Kinh tế luôn chào đón học sinh Quảng Ngãi trở thành DUE_ers vào tháng 9 tới.\n Những #điểm_nhấn trong tuyển sinh năm 2024 mà team #2K6 không thể bỏ qua:\n Chương trình cử nhân Kiểm toán tích hợp chứng chỉ nghề nghiệp quốc tế Anh Quốc (ACCA)\n 02 ngành/chuyên ngành có chương trình đào tạo 100% bằng tiếng Anh: #kinh_doanh_quốc_tế và #marketing_số\n Thêm lựa chọn học trao đổi 1-2 học kỳ với 10 trường đào tạo kinh tế hàng đầu Việt Nam\n Cơ hội sở hữu cùng lúc 02 bằng đại học với cơ chế đào tạo linh hoạt của DUE \n Học #thạc_sĩ ngay trong chương trình đào tạo đào tạo đại học\n Rút ngắn lộ trình chinh phục tấm bằng #thạc_sĩ\n Tham gia Tuyển sinh Đại học Kinh tế Đà Nẵng- DUE: www.fb.com/groups/tuyensinhddq để cập nhật thông tin tuyển sinh mới nhất!\n-------------\n CALL NOW \n 0911 223 777 - 02363 522345\nTruy cập: http://tuyensinh.due.udn.vn\n Inbox Trường Đại học Kinh tế - Đại học Đà Nẵng để được tư vấn, giải đáp thắc mắc\n-------------\n#DUE #tiepbuoctruongthi #tuyensinh #tuyensinh2024 #tuvantuyensinh #xettuyen #tuyenthang #cunhan #chinhquy #quocte #thanhtichhoctap #nanglucngoaingu #hocsinhgioi #IELTS #TOEFLiBT #xethocba #danhgianangluc #diemthITHPT']","['Tất cả, 41', 'Thích, 27', 'Yêu thích, 14']",[],3136,"Thứ bảy, 9 Tháng 3, 2024 lúc 16:49"
"['[CHƯƠNG TRÌNH “TIẾP BƯỚC TRƯỜNG THI 2024” TẠI QUẢNG NGÃI]\nCập bến Nhà văn hoá lao động tỉnh Quảng Ngãi vào chiều nay (9/3), Chương trình “Tiếp bước trường thi 2024” sẽ đem đến nhiều thông tin bổ ích, thú vị cho học sinh THPT trên địa bàn tỉnh. Chương trình được trực tiếp trên Đài PT – TH Quảng Ngãi, Fanpage Kênh tuyển sinh hướng nghiệp: www.fb.com/tuyensinhhuongnghiep.vn, Youtube Kênh tuyển sinh hướng nghiệp: https://www.youtube.com/@KenhTuyenSinhHuongNghiep.\n Hiện diện t… Xem thêm', 'Tư vấn xét tuyển ĐH – CĐ năm 2024 tại Quảng Ngãi\nChủ đề: TIẾP BƯỚC TRƯỜNG THI\nThời gian: 14g30 - 16g10, ngày 09/03/2024\nPhát sóng trực tiếp trên:\n- Đài PTTH Quảng Ngãi\n- Youtube:   / kenhtuyensinhhuongnghiep  \n- Fanpage:  / tuyensinhhuongnghiep.vn  \n#tiepbuoctruongthi2024 \n#tuyensinhhuongnghiep.vn\n#KenhTuyensinhHuongnghiep\n--------\nKính mong Ban giám hiệu và Đoàn thanh niên các trường THPT thông báo đến các bạn học sinh lớp 12 để các bạn nắm bắt những thông tin quan trọng về việc xét tuyển ĐH-CĐ năm 2024.\nĐăng ký theo dõi Kênh để xem những tin tức mới nhất:   \nWebsite: https://tuyensinhhuongnghiep.vn/\nFanpage:  / kenhtuyensinhhuongnghiep  \nYoutube Channel:    / tuyensinhhuongnghiep.vn  \n----------\nThông tin liên hệ:\nTầng 4, 160 Nam Kỳ Khởi Nghĩa, Quận 3, Tp Hồ Chí Minh \nHOTLINE: 0902.870.779 - 0909.430.902\nĐT: 028 3930 2918 \nEmail: tshn.net@gmail.com']","['Tất cả, 22', 'Thích, 18', 'Yêu thích, 4']",[],5175,"Thứ bảy, 9 Tháng 3, 2024 lúc 14:31"
"['[TUYỂN SINH ĐẠI HỌC CHÍNH QUY]\n KHÁM PHÁ NGÀNH HỌC 2024 \n Ngành LUẬT KINH TẾ \n Mã trường: 𝗗𝗗𝗤\n Mã ngành: 𝟳𝟯𝟴𝟬𝟭𝟬𝟳\n Phương thức tuyển sinh: http://due.udn.vn/vi-vn/tuvantuyensinh2024/gt/cid/5417\n---------------------------------------------------\nTUYỂN SINH ĐẠI HỌC CHÍNH QUY 2024\nMÙA TUYỂN SINH 2024, CÓ 225 CHỈ TIÊU ĐẾN VỚI KHOA LUẬT, TRƯỜNG ĐẠI HỌC KINH TẾ,  ĐẠI HỌC ĐÀ NẴNG, TRONG ĐÓ GỒM 02 NGÀNH: \n• 145 Chỉ tiêu Luật Kinh tế (chuyên ngành Luật Kinh doanh) \nMÃ NGÀNH: 7380107\n• 80 Chỉ tiêu Luật (chuyên ngành Luật học) \nMÃ NGÀNH: 7380101\nMÃ TRƯỜNG: DDQ\n   Năm 2024, Trường Đại học Kinh tế xét tuyển chương trình cử nhân chính quy theo các phương thức sau: \n(1) Xét tuyển thẳng thí sinh đạt giải trong các kỳ thi học sinh giỏi quốc gia, quốc tế; \n(2) Xét tuyển dựa trên thành tích học tập và năng lực ngoại ngữ; \n(3) Xét tuyển dựa trên kết quả học tập THPT (học bạ) của ba môn trong tổ hợp môn xét tuyển; \n(4) Xét tuyển dựa trên kết quả kỳ thi đánh giá năng lực của ĐH Quốc gia TP.HCM;\n(5) Xét tuyển dựa trên kết quả thi tốt nghiệp THPT năm 2024.\n---------------------------------------------------\n Thông tin liên hệ\n Website Khoa Luật: http://due.udn.vn/vi-vn/khoa/luat\n Fanpage Khoa Luật: https://www.facebook.com/khoaluatdaihockinhtedanang\n-------------\n Tham gia Tuyển sinh Đại học Kinh tế Đà Nẵng- DUE: www.fb.com/groups/tuyensinhddq để cập nhật thông tin tuyển sinh mới nhất!\n-------------\n CALL NOW \n 0911 223 777 - 02363 522345\nTruy cập: http://tuyensinh.due.udn.vn\n Inbox @Trường Đại học Kinh tế - Đại học Đà Nẵng (www.fb.com/FaceDUE) để được tư vấn, giải đáp thắc mắc\n-------------\n#DUE #tuyensinh #tuyensinh2024 #tuvantuyensinh #khampha #nganhhoc #luatkinhte #luatkinhdoanh']","['Tất cả, 63', 'Thích, 46', 'Yêu thích, 16', 'Thương thương, 1']",[],6433,"Thứ Sáu, 8 Tháng 3, 2024 lúc 19:41"
"['[CHƯƠNG TRÌNH “TIẾP BƯỚC TRƯỜNG THI 2024” TẠI QUẢNG NAM]\n CƠ HỘI VIỆC LÀM RỘNG MỞ TỪ DUE \n Chiều nay (08/3), tại Trung tâm Văn hóa tỉnh Quảng Nam, chương trình “Tiếp bước trường thi 2024” tiếp tục diễn ra với sự tham gia của đông đảo học sinh THPT trên địa bàn tỉnh. Chương trình được trực tiếp trên Đài PT – TH Quảng Nam Fanpage Kênh tuyển sinh hướng nghiệp: www.fb.com/tuyensinhhuongnghiep.vn, Youtube Kênh tuyển sinh hướng nghiệp: https://www.youtube.com/@KenhTuyenSinhHuongNghiep. Chương trình thu hút hơn 800 học sinh THPT trên địa bàn thành phố Tam Kỳ (tỉnh Quảng Nam) tại Trung tâm Văn hóa tỉnh.\n Đồng hành cùng thí sinh, TS. Trần Đình Khôi Quốc - Trưởng Ban Đào tạo Đại học Đà Nẵng và TS. Võ Hồng Tâm - Phó Trưởng Phòng Đào tạo - Trường Đại học Kinh tế - Đại học Đà Nẵng đã cung cấp các thông tin tuyển sinh đại học năm 2024 đồng thời giải đáp các thắc mắc về phương thức xét tuyển, cách thức đăng kí xét tuyển vào trường.\n Tại chương trình, TS. Võ Hồng Tâm đã gửi lời chúc tốt đẹp đến tất cả các thí sinh tỉnh Quảng Nam trong kỳ thi tốt nghiệp THPT năm 2024 sắp tới. Với những băn khoăn trong quá trình đăng kí xét tuyển vào Trường Đại học Kinh tế, TS. Võ Hồng Tâm cho biết thí sinh nếu dành sự yêu thích và quyết tâm vào ngành học của trường thì hoàn toàn có thể xét tuyển nhiều phương thức cùng lúc để thêm cơ hội trúng tuyển. Bên cạnh đó, việc tìm hiểu kỹ các mã tổ hợp môn xét tuyển vào các ngành cũng khá quan trọng trong quá trình đăng kí. Vì vậy để có thông tin chính xác về phương thức xét tuyển, chỉ tiêu tuyển sinh, mã tổ hợp môn xét tuyển, quý phụ huynh, học sinh nên truy cập vào Cổng thông tin tư vấn tuyển sinh của Trường: http://due.udn.vn/vi-vn/tuvantuyensinh2024/gt/cid/5417 \n Đặt câu hỏi tại chương trình, bạn Bảo Quốc (THPT Trần Cao Vân) dành sự quan tâm về chương trình đào tạo và cơ hội việc làm đối với chuyên ngành Quản trị sự kiện của Trường. TS. Võ Hồng Tâm cho biết chuyên ngành Quản trị sự kiện thuộc ngành học Quản trị dịch vụ du lịch và lữ hành với mã đăng kí 7810103 là một trong những thế mạnh đào tạo của Nhà trường trong lĩnh vực du lịch – tổ chức sự kiện. Với lợi thế tọa lạc tại một trong những trung tâm kinh tế, văn hóa, xã hội năng động bậc nhất cả nước là Đà Nẵng, cơ hội việc làm đối với sinh viên tốt nghiệp các ngành học du lịch của Nhà trường luôn rộng mở và hoàn toàn có thể thăng tiến trong lĩnh vực này. \n Bạn Cẩm Ly cùng nhiều bạn học khác tại THPT Lê Quý Đôn bày tỏ sự hứng thú với ngành Thương mại điện tử và Kinh doanh quốc tế của Trường Đại học Kinh tế, từ đó đặt thắc mắc về cơ hội của các ngành này sau khi ra trường. Dẫn chứng điềm đầu vào rất cao trong nhiều năm qua, TS. Võ Hồng Tâm cho biết 02 ngành trên được thế hệ GenZ khá yêu thích và đặt lên các nguyện vọng hàng đầu trong mỗi mùa tuyển sinh. Đồng thời, nhu cầu về nguồn nhân lực chất lượng cao trong lĩnh vực Thương mại điện tử và Kinh doanh quốc tế vẫn rất lớn nên nhiều năm qua tỉ lệ sinh viên có việc làm sau 1 năm tốt nghiệp luôn ở mức trên 99%. Uy tín và thương hiệu trong công tác đào tạo của Nhà trường cũng là một lý do mà các nhà tuyển dụng luôn đánh giá cao sinh viên tốt nghiệp từ Trường Đại học Kinh tế - Đại học Đà Nẵng.\n Tạm biệt học sinh đến từ TP Tam Kỳ (Quảng Nam), chương trình “Tiếp bước trường thi 2024” sẽ cập bến Nhà Văn hóa Lao động tỉnh Quảng Ngãi vào 14h30 chiều mai (09/3). Kính mời quý phụ huynh, học sinh theo dõi, đón xem và đặt câu hỏi cho các chuyên gia tại chương trình!\n Những #điểm_nhấn trong tuyển sinh năm 2024 mà team #2K6 không thể bỏ qua:\n Chương trình cử nhân Kiểm toán tích hợp chứng chỉ nghề nghiệp quốc tế Anh Quốc (ACCA)\n 02 ngành/chuyên ngành có chương trình đào tạo 100% bằng tiếng Anh: #kinh_doanh_quốc_tế và #marketing_số\n Thêm lựa chọn học trao đổi 1-2 học kỳ với 10 trường đào tạo kinh tế hàng đầu Việt Nam\n Cơ hội sở hữu cùng lúc 02 bằng đại học với cơ chế đào tạo linh hoạt của DUE \n Học #thạc_sĩ ngay trong chương trình đào tạo đào tạo đại học\n Rút ngắn lộ trình chinh phục tấm bằng #thạc_sĩ\n Tham gia Tuyển sinh Đại học Kinh tế Đà Nẵng- DUE: www.fb.com/groups/tuyensinhddq để cập nhật thông tin tuyển sinh mới nhất!\n-------------\n CALL NOW \n 0911 223 777 - 02363 522345\nTruy cập: http://tuyensinh.due.udn.vn\n Inbox Trường Đại học Kinh tế - Đại học Đà Nẵng để được tư vấn, giải đáp thắc mắc\n-------------\n#DUE #tiepbuoctruongthi #tuyensinh #tuyensinh2024 #tuvantuyensinh #xettuyen #tuyenthang #cunhan #chinhquy #quocte #thanhtichhoctap #nanglucngoaingu #hocsinhgioi #IELTS #TOEFLiBT #xethocba #danhgianangluc #diemthiTHPT']","['Tất cả, 42', 'Thích, 30', 'Yêu thích, 12']",[],8323,"Thứ Sáu, 8 Tháng 3, 2024 lúc 18:19"
"[' TIẾP BƯỚC TRƯỜNG THI NĂM 2024 TẠI QUẢNG NAM\n Chiều nay (08/3), tại Trung tâm Văn hóa tỉnh Quảng Nam, chương trình “Tiếp bước trường thi 2024” tiếp tục diễn ra với sự tham gia của đông đảo học sinh THPT trên địa bàn tỉnh. Chương trình được trực tiếp trên Fanpage Kênh tuyển sinh hướng nghiệp: https://www.facebook.com/tuyensinhhuongnghiep.vn, Youtube Kênh tuyển sinh hướng nghiệp: https://www.youtube.com/@KenhTuyenSinhHuongNghiep.\n Đồng hành cùng thí sinh, TS. Trần Đình Kh… Xem thêm', 'Tư vấn xét tuyển ĐH – CĐ năm 2024 tại Quảng Nam\nChủ đề: TIẾP BƯỚC TRƯỜNG THI\nThời gian: 14g30 - 16g10, ngày 08/03/2024\nPhát sóng trực tiếp trên:\n- Đài PTTH Quảng Nam\n- Youtube:   / kenhtuyensinhhuongnghiep  \n- Fanpage:  / tuyensinhhuongnghiep.vn  \n#tiepbuoctruongthi2024 \n#tuyensinhhuongnghiep.vn\n#KenhTuyensinhHuongnghiep\n--------\nKính mong Ban giám hiệu và Đoàn thanh niên các trường THPT thông báo đến các bạn học sinh lớp 12 để các bạn nắm bắt những thông tin quan trọng về việc xét tuyển ĐH-CĐ năm 2024.\nĐăng ký theo dõi Kênh để xem những tin tức mới nhất:   \nWebsite: https://tuyensinhhuongnghiep.vn/\nFanpage:  / kenhtuyensinhhuongnghiep  \nYoutube Channel:    / tuyensinhhuongnghiep.vn  \n----------\nThông tin liên hệ:\nTầng 4, 160 Nam Kỳ Khởi Nghĩa, Quận 3, Tp Hồ Chí Minh \nHOTLINE: 0902.870.779 - 0909.430.902\nĐT: 028 3930 2918 \nEmail: tshn.net@gmail.com']","['Tất cả, 19', 'Thích, 18', 'Yêu thích, 1']",[],10818,"Thứ Sáu, 8 Tháng 3, 2024 lúc 14:31"
"['[TUYỂN SINH ĐẠI HỌC CHÍNH QUY]\n KHÁM PHÁ NGÀNH HỌC 2024 \n Ngành LUẬT \n Mã trường: 𝗗𝗗𝗤\n Mã ngành: 𝟳𝟯𝟴𝟬𝟭𝟬𝟭\n Phương thức tuyển sinh: http://due.udn.vn/vi-vn/tuvantuyensinh2024/gt/cid/5417\n---------------------------------------------------\nTUYỂN SINH ĐẠI HỌC CHÍNH QUY 2024\nMÙA TUYỂN SINH 2024, CÓ 225 CHỈ TIÊU ĐẾN VỚI KHOA LUẬT, TRƯỜNG ĐẠI HỌC KINH TẾ,  ĐẠI HỌC ĐÀ NẴNG, TRONG ĐÓ GỒM 02 NGÀNH: \n• 145 Chỉ tiêu Luật Kinh tế (chuyên ngành Luật Kinh doanh) \nMÃ NGÀNH: 7380107\n• 80 Chỉ tiêu Luật (chuyên ngành Luật học) \nMÃ NGÀNH: 7380101\nMÃ TRƯỜNG: DDQ\n   Năm 2024, Trường Đại học Kinh tế xét tuyển chương trình cử nhân chính quy theo các phương thức sau: \n(1) Xét tuyển thẳng thí sinh đạt giải trong các kỳ thi học sinh giỏi quốc gia, quốc tế; \n(2) Xét tuyển dựa trên thành tích học tập và năng lực ngoại ngữ; \n(3) Xét tuyển dựa trên kết quả học tập THPT (học bạ) của ba môn trong tổ hợp môn xét tuyển; \n(4) Xét tuyển dựa trên kết quả kỳ thi đánh giá năng lực của ĐH Quốc gia TP.HCM;\n(5) Xét tuyển dựa trên kết quả thi tốt nghiệp THPT năm 2024.\n---------------------------------------------------\n Thông tin liên hệ\n Website Khoa Luật: http://due.udn.vn/vi-vn/khoa/luat\n Fanpage Khoa Luật: https://www.facebook.com/khoaluatdaihockinhtedanang\n-------------\n Tham gia Tuyển sinh Đại học Kinh tế Đà Nẵng- DUE: www.fb.com/groups/tuyensinhddq để cập nhật thông tin tuyển sinh mới nhất!\n-------------\n CALL NOW \n 0911 223 777 - 02363 522345\nTruy cập: http://tuyensinh.due.udn.vn\n Inbox @Trường Đại học Kinh tế - Đại học Đà Nẵng (www.fb.com/FaceDUE) để được tư vấn, giải đáp thắc mắc\n-------------\n#DUE #tuyensinh #tuyensinh2024 #tuvantuyensinh #khampha #nganhhoc #luat\n#luathoc', 'Viết bình luận...']","['Tất cả, 70', 'Thích, 56', 'Yêu thích, 14']",[],12077,"Thứ Sáu, 8 Tháng 3, 2024 lúc 11:39"
"['[TUYỂN SINH ĐẠI HỌC CHÍNH QUY]\n KHÁM PHÁ NGÀNH HỌC 2024 \n Ngành KIỂM TOÁN \n Mã trường: 𝗗𝗗𝗤\n Mã ngành: 7340402\n Phương thức tuyển sinh: http://due.udn.vn/vi-vn/tuvantuyensinh2024/gt/cid/5417\n---------------------------------------------------\n Với mong muốn tiếp tục sứ mệnh đào tạo những thế hệ sinh viên tài năng trong ngành Kiểm toán, Khoa Kế toán, Trường Đại học Kinh tế - Đại học Đà Nẵng luôn không ngừng nâng cao chất lượng đào tạo để đáp ứng được nguyện vọng của số lượng lớn các sĩ tử mỗi năm.  Chương trình cử nhân ngành Kiểm toán với những định hướng, mục tiêu và nền tảng kiến thức được xây dựng để đào tạo các cử nhân có năng lực chuyên môn nhằm trở thành các chuyên gia kiểm toán, kế toán, tài chính và kiểm soát nội bộ; đồng thời mở ra các cơ hội việc làm ở nhiều lĩnh vực khác nhau trong môi trường kinh doanh năng động và hội nhập quốc tế.\n Đặc biệt từ năm 2024, các thí sinh trúng tuyển vào ngành Kiểm toán của Khoa Kế toán - DUE có cơ hội tham gia chương trình cử nhân Kiểm toán tích hợp chứng chỉ nghề nghiệp quốc tế (ACCA) nhằm gia tăng cơ hội nghề nghiệp cho người học tiếp cận với môi trường làm việc quốc tế trong lĩnh vực Kế toán- Kiểm toán. \n Nhằm mang đến cái nhìn chi tiết nhất, giúp các bạn học sinh – sinh viên có thể hình dung cụ thể hơn về những gì mình sẽ được trải nghiệm khi theo đuổi ngành học này tại DUE cũng như cung cấp thêm thông tin cần thiết cho quý phụ huynh, khoa Kế toán xin giới thiệu sơ lược chương trình đào tạo ngành Kiểm toán chính quy: \n Mô tả chương trình\n Lợi ích của chương trình\n Chuẩn đầu ra\n Cơ hội nghề nghiệp\n Cấu trúc chương trình\n---------------------------------------------------\n Thông tin liên hệ\n Website Khoa Kế toán: http://due.udn.vn/vi-vn/khoa/ke-toan\n Fanpage: Kế toán & Kiểm toán DUE: https://www.facebook.com/AccountingDepartmentDUE\n-------------\n Tham gia Tuyển sinh Đại học Kinh tế Đà Nẵng- DUE: www.fb.com/groups/tuyensinhddq để cập nhật thông tin tuyển sinh mới nhất!\n-------------\n CALL NOW \n 0911 223 777 - 02363 522345\nTruy cập: http://tuyensinh.due.udn.vn\n Inbox @Trường Đại học Kinh tế - Đại học Đà Nẵng (www.fb.com/FaceDUE) để được tư vấn, giải đáp thắc mắc\n-------------\n#DUE #tuyensinh #tuyensinh2024 #tuvantuyensinh #khampha #nganhhoc #ketoan\n#kiemtoan', 'Trần Thị Bích\nTrần Ngọc sau gần 2 năm học kế toán còn ổn ko']","['Tất cả, 48', 'Thích, 37', 'Yêu thích, 11']",[],14481,"Thứ Năm, 7 Tháng 3, 2024 lúc 19:42"
