content,emoji,comment,current,time
"["" THƯ MỜI VIẾT BÀI HỘI THẢO KHOA HỌC QUỐC TẾ LẦN THỨ 04 VỀ MARKETING (MICA-2024) \nTiếp nối thành công của ba kỳ hội thảo MICA tổ chức tại Đà Nẵng vào các năm 2016, 2018 và 2022, Trường Đại học Kinh tế - Đại học Đà Nẵng sẽ tổ chức Hội thảo Quốc tế về Marketing - Marketing trong Kỷ nguyên kết nối (MICA-2024) lần thứ 04 trong ngày 28  tháng 08 năm 2024 với chủ đề “HUMAN-TO-HUMAN MARKETING: HOW MARKETING FINDS MEANING IN A HYPERCONNECTED WORLD”\nCác đối tác tham gia đồng tổ chức MICA-2024 gồm: Darmstadt University of Applied Sciences (Đức), Trường Đại học Kinh tế Quốc dân, Trường Đại học Tài chính - Marketing, và Trường Đại học Ngoại thương\nMICA - Marketing In Connected Age là hội thảo khoa học quốc tế theo chuyên đề, định hướng vào những xu hướng mới nhất và nổi bật nhất của marketing hiện đại, được tổ chức 2 năm một lần do Trường Đại học Kinh tế - Đại học Đà Nẵng phối hợp với các đối tác trong nước và quốc tế. Sứ mệnh của MICA là kết nối cộng đồng nghiên cứu, ứng dụng, thực hành Marketing của Việt Nam và quốc tế, vì sự phát triển của khoa học và công nghệ marketing, phục vụ lợi ích của cộng đồng. \n Các mốc thời gian:\n20/05/2024 : Hạn cuối nộp hồ sơ \n20/06/2024 : Thông báo chấp nhận/từ chối \n23/07/2024 : Hạn cuối đăng ký \n23/08/2024 : Diễn ra hội thảo\n Địa điểm: Trường Đại học Kinh tế - Đại học Đà Nẵng \n- Thời hạn gửi bài: trước ngày 20/5/2024 \n- Email tiếp nhận bài viết: mica@due.edu.vn \n- Ngôn ngữ hội thảo: Tiếng Anh \n Thể thức bài viết được đính kèm:\nhttps://drive.google.com/.../1DRR1VX620vjcgd6bkrqKum35B1e... \n Mọi thông tin thêm về Hội thảo vui lòng liên hệ:  \nTS. Đường Thị Liên Hà (+84 2363 889 466) hoặc TS. Trương Trần Trâm Anh (+84 934904507)\nEmail: mica@due.edu.vn\nWeb: http://due.udn.vn/mica\n— — —\n THE 4th INTERNATIONAL CONFERENCE ON MARKETING IN THE CONNECTED AGE (MICA-2024) - CALL FOR PAPERS \nFollowing the success of the three previous conferences held in 2016, 2018 and 2022, The University of Danang - University of Economics (DUE, Vietnam), Darmstadt University of Applied Sciences (Germany), National University of Economics (Vietnam), University of Finance & Marketing (Vietnam), and Foreign Trade University (Vietnam), are organizing the 4th International Conference on Marketing in the Connected Age (MICA-2024), to be held on August 23rd, 2024 in Danang City, Vietnam, with the theme “HUMAN-TO-HUMAN MARKETING: HOW MARKETING FINDS MEANING IN A HYPERCONNECTED WORLD”.\nMICA - Marketing In Connected Age is an international thematic scientific conference, oriented on the latest and most prominent trends in modern marketing, organized every 2 years by the collaboration of The University of Danang - University of Economics with national and international partners. MICA's mission is to connect the Vietnamese and international Marketing research, application, and practice communities, for the development of marketing science and technology, serving the interests of the community.\n Key dates:\nMay 20th, 2024: Submission deadline\nJune 20th, 2024: Notification of acceptance/rejection\nJuly 23rd, 2024: Registration deadline\nAugust 23rd, 2024: Conference event\n Location: University of Economics - The University of Danang\n- Submission email: mica@due.edu.vn\n- Conference language: English\n MICA-2024 template: https://drive.google.com/.../1DRR1VX620vjcgd6bkrqKum35B1e... \n Contact for queries: \nEmail: mica@due.edu.vn\nTel: Conference Administrator: Dr. Lien Ha Duong (+84 2363 889 466)\nConference Program Committee: Dr. Truong Tran Tram Anh (+84 934904507) Conference secretariat: Ms. Linh Ha (+84 2363 954 243)\n- - -\n#MICA2024\n#Marketingintheconnectedage \n#MarketingDUE""]","['Tất cả, 30', 'Thích, 21', 'Yêu thích, 8', 'Wow, 1']",[],118771,"Thứ Sáu, 12 Tháng 1, 2024 lúc 10:03"
"['[SAO THÁNG GIÊNG NGUYỄN TRẦN KHÁNH VY: CHÁY HẾT MÌNH VỚI NHỮNG NĂM THÁNG TUỔI TRẺ]\n Bằng những nỗ lực trong học tập và sôi nổi trong các hoạt động của Nhà trường và xã hội, sinh viên Nguyễn Trần Khánh Vy - lớp 46K01.4, Khoa Kinh doanh quốc tế đã vinh dự nhận được Giải thưởng Sao Tháng Giêng cấp Trung ương năm 2023. Bên cạnh đó, Khánh Vy cũng đã đạt được danh hiệu Sinh viên 5 Tốt cấp Trường, cấp Đại học Đà Nẵng và cấp Thành phố Đà Nẵng năm học 2021 - 2022.\n Tham gia hoạt động Đoàn - Hội giúp mình “lột xác” hơn, từ 1 người hướng nội, nhút nhác, mình trở nên tự tin, hòa đồng, có thể đứng giữa đám đông và trở thành lead những chương trình lớn. Điều quý giá nhất mà mình có được khi tham gia hoạt động Đoàn - Hội chính là những mối quan hệ thân thiết chính. Mọi người không chỉ hỗ trợ nhau trong lúc chạy chương trình mà còn trong cả học tập, cuộc sống. Những niềm vui, nụ cười đó là điều mà mình luôn trân quý và là động lực khi mình gặp nhiều thử thách trong cuộc sống, Khánh Vy cho biết.\n Gửi đến các bạn sinh viên, mình mong rằng các bạn sẽ tìm được hướng đi phù hợp với bản thân, tìm được cách để phát triển bản thân tốt nhất mà không cần phải đi theo con đường giống với người khác. Mỗi cá nhân là một bản thể, khác biệt và duy nhất, và sẽ có những con đường phát triển bản thân khác nhau. Thành công không phải là tốt hơn người khác, mà là tốt hơn chính mình ngày hôm qua. Mình tin rằng, chúng ta ai cũng sẽ trở thành “ngôi sao sáng” của chính cuộc đời mình, đủ nỗ lực - sớm hay muộn thành công ắt sẽ tới.\n Xem thêm tại: http://due.udn.vn/.../tintuc/tintucchitiet/id/18417/bid/455\n#DUE #sinhvien #saothanggieng', 'Kiệm Trần\nChúc mừng Khanh Vy\n2']","['Tất cả, 263', 'Thích, 136', 'Yêu thích, 126', 'Thương thương, 1']",[],121184,"Thứ Năm, 11 Tháng 1, 2024 lúc 19:16"
"[' 240 CHỈ TIÊU HỆ VỪA LÀM VỪA HỌC \n 04 NGÀNH ĐÀO TẠO \n THỜI GIAN NHẬN HỒ SƠ ĐẾN HẾT 20/1/2024\n Đăng ký xét tuyển ngay tại: https://due.udn.vn/vi-vn/thongbao/thongbaochitiet/id/18197/bid/456\n TOP 04 LÝ DO ĐỂ CHƯƠNG TRÌNH HỆ VỪA LÀM VỪA HỌC LÀ CHƯƠNG TRÌNH ƯU VIỆT HÀNG ĐẦU \n BẰNG CẤP TƯƠNG ĐƯƠNG VỚI CÁC HỆ ĐÀO TẠO KHÁC: Chương trình đào tạo, đội ngũ giảng viên, hình thức của hệ Vừa làm vừa học được đánh giá hoàn toàn giống với hình thức đào tạo chính quy. Hình thức đào tạo cũng không thể hiện trên bằng Cử nhân khi tốt nghiệp.\n RỘNG MỞ CƠ HỘI NÂNG CAO TRÌNH ĐỘ: Theo Quy chế đào tạo thạc sĩ, tiến sĩ hiện hành, sinh viên tốt nghiệp đại học hệ vừa làm vừa học đủ điều kiện để tiếp tục học lên Cao học, nghiên cứu sinh và lấy bằng Thạc sĩ, Tiến sĩ chuyên ngành đó.\n NHỮNG NGÀNH HOT, NHU CẦU CAO CỦA XÃ HỘI: 04 ngành đào tạo Hệ Vừa làm vừa học DUE đều là những ngành phù hợp với bối cảnh phục hồi phát triển kinh tế hậu Covid, đáp ứng nhu cầu của Nhà tuyển dụng.\n THỜI GIAN HỌC TẬP LINH HOẠT: Nhà trường bố trí lịch học vào các buổi tối trong tuần và các ngày cuối tuần. Như vậy người học sẽ dễ dàng hơn trong việc sắp xếp thời gian, công việc để vừa tham gia học tập, nghiên cứu, đảm bảo tiếp tục công việc và duy trì thu nhập.\n Đăng ký xét tuyển ngay tại: https://due.udn.vn/.../thongbaochitiet/id/18197/bid/456\n Chi tiết liên hệ: Phòng Đào tạo, Trường Đại Học Kinh Tế, 71 Ngũ Hành Sơn, phường Mỹ An, quận Ngũ Hành Sơn, thành phố Đà Nẵng, website: https://due.udn.vn, điện thoại liên hệ: (0236) 3950 110\n#DUE #tuyensinh #vualamvuahoc #ketoan #luat #quanlynhanuoc #quantrikinhdoanh', 'Huỳnh Trung Quân\nIb mình vs']","['Tất cả, 34', 'Thích, 32', 'Yêu thích, 2']",[],123008,"Thứ Năm, 11 Tháng 1, 2024 lúc 13:56"
"['THÔNG BÁO V/V ĐĂNG KÝ THAM DỰ CHUỖI CHUYÊN ĐỀ HỌC THUẬT VỀ AI – AI WEBINAR ORIENTATION VỚI CITY UNIVERSITY OF SEATTLE, HOA KỲ\nTrong khuôn khổ hợp tác giữa Trường Đại học Kinh tế và City University of Seattle (CityU), Hoa Kỳ, hai bên sẽ phối hợp tổ chức chuỗi chuyên đề về AI hoàn toàn miễn phí trong khoảng thời gian từ 26/02 – 01/03/2024. Thông tin cụ thể như sau:\n1. Đối tượng: dành cho sinh viên, học viên sau đại học, cán bộ, giảng viên của Trường Đại học Kinh tế, Đại học Đà Nẵng có quan tâm\n2. Thông tin về Webinar:\n- Số lượng: 3 buổi trong khoảng thời gian từ 26/02 – 01/03/2024\n- Thời gian: 7h30 – 8h15\n- Hình thức tổ chức: webinar trực tuyến bằng tiếng Anh\n- Diễn giả: Giáo sư từ CityU và các diễn giả hoạt động trong lĩnh vực AI tại Mỹ và Việt Nam\n- Nội dung: chuỗi Webinar sẽ cung cấp cho người nghe các kiến thức học thuật cũng như những thông tin thực tiễn các vấn đề liên quan đến AI. Dự kiến các nội dung sẽ bao gồm nhưng không giới hạn ở các chủ đề như: tổng quan (overview); các tình huống thực tế (case study); ứng dụng và giải pháp về AI trong doanh nghiệp (AI applications and solutions); các chiến lược quản trị AI (managing AI strategy). Người nghe có thể đề xuất thêm cụ thể các vấn đề về AI mà mình mong muốn được tìm hiểu tại form đăng ký.\n3. Đăng ký tham dự:\nSinh viên, cán bộ, giảng viên mong muốn tham dự tham gia chuỗi webinar vui lòng đăng ký tham gia tại link sau: https://forms.office.com/r/AcKcYT88PQ\nThời hạn đăng ký đến hết ngày 30/01/2024\n* Lưu ý: Sinh viên sẽ được cộng điểm rèn luyện khi tham dự chuỗi webinar (10 điểm vào mục II – hoạt động tình nguyện mang tính học thuật, phát triển kỹ năng)\n#DUE #CityU #webinar']","['Thích, 18']",[],124329,"Thứ Tư, 10 Tháng 1, 2024 lúc 15:07"
"[' Chất lượng sinh viên chương trình đào tạo quốc tế sau khi ra trường - Đáp ứng yêu cầu của các nhà tuyển dụng \nXem thêm tại: https://nhandantv.vn/lien-ket-dao-tao-nang-cao-chat-luong...\nTrong thời đại toàn cầu hóa và phát triển công nghệ như hiện nay, việc đào tạo nhân lực chất lượng cao là một yêu cầu quan trọng đối với các nhà tuyển dụng. Để đáp ứng yêu cầu này, chương trình đào tạo quốc tế đã trở thành một lựa chọn phổ biến cho sinh viên. Trong bài viết này, chúng ta sẽ tìm hiểu về chất lượng của sinh viên sau khi hoàn thành chương trình đào tạo quốc tế và khả năng của họ trong việc đáp ứng yêu cầu của các nhà tuyển dụng.\nMột trong những lợi ích quan trọng của chương trình đào tạo quốc tế là khả năng hội nhập văn hóa và sự thông minh đa văn hóa của sinh viên. Bằng việc học tập và sống cùng với sinh viên đến từ nhiều quốc gia khác nhau, sinh viên được trải nghiệm sự đa dạng văn hóa, học hỏi cách làm việc và giao tiếp hiệu quả với người khác. Điều này tạo ra một môi trường học tập đa dạng và phát triển các kỹ năng xã hội quan trọng như lãnh đạo, làm việc nhóm và quản lý thời gian.\nChất lượng giảng dạy và học tập của chương trình đào tạo quốc tế cũng là một yếu tố quan trọng. Các trường đại học và tổ chức đào tạo quốc tế thường có đội ngũ giảng viên giàu kinh nghiệm, được đào tạo tốt và có nền tảng kiến thức rộng. Họ sử dụng các phương pháp giảng dạy hiện đại và tạo điều kiện cho sinh viên tham gia vào các hoạt động thực tế, dự án và nghiên cứu. Điều này giúp sinh viên phát triển kỹ năng chuyên môn sâu cũng như khả năng phân tích, tư duy sáng tạo và giải quyết vấn đề.\nSau khi ra trường, sinh viên chương trình đào tạo quốc tế thường có nhiều cơ hội việc làm tốt và phát triển sự nghiệp. Các nhà tuyển dụng đánh giá cao chất lượng và đa dạng của kiến thức mà sinh viên có được trong quá trình học tập. Sự thông thạo về tiếng Anh và khả năng làm việc trong môi trường đa quốc gia cũng là các yếu tố hữu ích cho sinh viên khi xin việc. Các doanh nghiệp ngày nay đang tìm kiếm nhân viên có khả năng thích nghi nhanh, sáng tạo và có tầm nhìn toàn cầu - điều mà chương trình đào tạo quốc tế có thể cung cấp.\nTuy nhiên, để đạt được thành công trong sự nghiệp sau khi ra trường, sinh viên cần có sự tự định hướng và cống hiến. Chương trình đào tạo quốc tế có thể cung cấp cơ hội và nền tảng tốt, nhưng thành công cuối cùng phụ thuộc vào sự nỗ lực và ý chí của từng sinh viên.\nNếu bạn đang có kế hoạch tham gia chương trình đào tạo quốc tế, hãy chuẩn bị tâm lý và sẵn sàng đối mặt với những thách thức mới. Hãy luôn cống hiến và học hỏi để trở thành một sinh viên xuất sắc và đáp ứng được yêu cầu của các nhà tuyển dụng.\n#DUE #daotao #quocte']","['Tất cả, 21', 'Thích, 19', 'Yêu thích, 2']",[],125854,"Thứ Tư, 10 Tháng 1, 2024 lúc 08:47"
"['CHÚC MỪNG ĐỒNG CHÍ ĐẶNG MINH THẢO TRỞ THÀNH THÀNH VIÊN HỘI ĐỒNG TRƯỜNG TRƯỜNG ĐẠI HỌC KINH TẾ - ĐẠI HỌC ĐÀ NẴNG NHIỆM KỲ 2020 - 2025\nVừa qua, đồng chí Đặng Minh Thảo - Ủy viên Ban Thường vụ Đoàn Trường đã chính thức được Hội đồng Đại học Đà Nẵng công nhận là thành viên Hội đồng trường Trường Đại học Kinh tế. Bước tiến này không chỉ minh chứng cho sự đóng góp và nỗ lực không ngừng nghỉ của đồng chí mà còn là niềm tự hào của tập thể Ban Chấp hành Đoàn TNCS Hồ Chí Minh Trường Đại học Kinh tế - Đại học Đà Nẵng.\nTrên chặng đường sắp tới, với tinh thần nhiệt huyết và sự bản lĩnh, mong rằng đồng chí sẽ luôn nỗ lực để cống hiến hết mình cho sự phát triển bền vững của Trường Đại học Kinh tế - Đại học Đà Nẵng.\nMột lần nữa, xin chúc mừng đồng chí Đặng Minh Thảo đã trở thành thành viên Hội đồng trường. Hy vọng đồng chí sẽ tiếp tục phấn đấu để đạt được những thành tựu tốt hơn nữa và trở thành tấm gương sáng cho các thế hệ sinh viên của Nhà Trường.\n CAM Media - Youth DUE \n#DUE #hoidongtruong']","['Tất cả, 215', 'Thích, 123', 'Yêu thích, 88', 'Thương thương, 3', 'Wow, 1']",[],127357,"Thứ Hai, 8 Tháng 1, 2024 lúc 19:08"
['[DUE NEWS]\n  Cùng điểm xem tuần qua nhà DUE có những tin tức – sự kiện nổi bật nào nhé:\n Lễ công bố Quyết định chuẩn y Bí thư Đảng ủy và Nghị quyết công nhận Chủ tịch Hội đồng trường Trường Đại học Kinh tế - ĐHĐN nhiệm kỳ 2020 – 2025\n Lễ ký kết thỏa thuận hợp tác với Trường Đại học Luật - Đại học Huế\n Ngày hội tư vấn - hướng nghiệp của Báo Tuổi trẻ tại Thừa Thiên – Huế và Đà Nẵng\n Data Got Talent 2023 mùa thứ 2: Khởi động vòng 1 - Data storytelling\n#DUE #news #tintuc #sukien'],"['Tất cả, 53', 'Thích, 39', 'Yêu thích, 14']",[],128376,"Thứ Hai, 8 Tháng 1, 2024 lúc 15:06"
"[' HƯỚNG ĐẾN KỶ NIỆM 74 NĂM NGÀY TRUYỀN THỐNG HỌC SINH, SINH VIÊN VIỆT NAM (09/01/1950 - 09/01/2024) \n Chúc tuổi trẻ DUE sẽ luôn ""cháy"" với tinh thần ""Nhiệt huyết - Năng động - Sáng tạo"" để gặt hái nhiều thành tích xuất sắc trong năm 2024 ']","['Tất cả, 37', 'Thích, 31', 'Yêu thích, 6']",[],129450,"Thứ Hai, 8 Tháng 1, 2024 lúc 10:37"
"['[LỄ CÔNG BỐ QUYẾT ĐỊNH CHUẨN Y BÍ THƯ ĐẢNG ỦY VÀ NGHỊ QUYẾT CÔNG NHẬN CHỦ TỊCH HỘI ĐỒNG TRƯỜNG TRƯỜNG ĐẠI HỌC KINH TẾ - ĐHĐN NHIỆM KỲ 2020 - 2025]\n Sáng ngày 08/01/2024, Trường Đại học Kinh tế - ĐHĐN long trọng tổ chức Lễ công bố Quyết định chuẩn y Bí thư Đảng ủy và Nghị quyết công nhận Chủ tịch Hội đồng trường Trường Đại học Kinh tế - ĐHĐN nhiệm kỳ 2020 - 2025.\n Tại buổi lễ, PGS.TS. Võ Thị Thúy Anh - Bí thư Đảng ủy Nhà trường được giữ chức vụ Chủ tịch Hội đồng trường Trường Đại học Kinh tế - ĐHĐN nhiệm kỳ 2020 - 2025 theo Nghị quyết số 109/NQ-HĐĐH ngày 29/12/2023 của Hội đồng Đại học Đà Nẵng. Đây là sự kiện có ý nghĩa đặc biệt quan trọng, đánh dấu sự bước phát triển mới trong công tác kiện toàn đội ngũ cán bộ lãnh đạo của Nhà trường, là cơ sở để Trường Đại học Kinh tế - ĐHĐN tiếp tục khẳng định vị thế mới trong hệ thống giáo dục và đào tạo.\n Hội đồng trường Trường Đại học Kinh tế - Đại học Đà Nẵng nhiệm kỳ 2020 - 2025 được công nhận theo Nghị Quyết số 50/NQ-HĐĐH ngày 05 tháng 7 năm 2023 của Hội đồng Đại học Đà Nẵng. Hội đồng Trường Đại học Kinh tế nhiệm kỳ 2020 - 2025 gồm 19 thành viên đại diện cho giảng viên, viên chức, người lao động, người học phát huy vai trò, năng lực và đề ra những chiến lược, chính sách và định hướng góp phần vào sự phát triển của nhà trường. \n Phát biểu tại buổi lễ, PGS.TS. Nguyễn Ngọc Vũ - Giám đốc Đại học Đà Nẵng chúc mừng PGS.TS. Võ Thị Thúy Anh được bổ nhiệm, đồng thời, ghi nhận và đánh giá cao những thành tựu của Trường Đại học Kinh tế, ĐHĐN trong thời gian qua. PGS.TS. Nguyễn Ngọc Vũ ghi nhận những đóng góp của PGS.TS. Võ Thị Thúy Anh và mong rằng tân Chủ tịch Hội đồng trường Trường Đại học Kinh tế - ĐHĐN sẽ phát huy tinh thần trách nhiệm, hoàn thành tốt nhiệm vụ được giao.   \n Phát biểu nhận trọng trách mới, PGS.TS. Võ Thị Thúy Anh bày tỏ lòng biết ơn sâu sắc đến lãnh đạo các cấp thành phố Đà Nẵng, Đại học Đà Nẵng, Đảng ủy, Hội đồng Trường, Tập thể lãnh đạo, Ban giám hiệu Trường Đại học Kinh tế, các cán bộ chủ chốt đã tin tưởng, tín nhiệm, hỗ trợ mình hoàn thành xuất sắc mọi nhiệm vụ trong suốt thời gian qua. Với niềm vinh dự, tự hào và tinh thần trách nhiệm cao, PGS.TS. Võ Thị Thúy Anh tin tưởng rằng, Trường Đại học Kinh tế - ĐHĐN sẽ đoàn kết một lòng, phát huy sức mạnh và trí tuệ của tập thể để đề ra chủ trương lớn, những quyết sách đúng đắn, những giải pháp mới hữu hiệu để phát triển Trường Đại học Kinh tế, ĐHĐN đạt được mục tiêu chiến lược đã đề ra, góp phần to lớn để Đại học Đà Nẵng trở thành Đại học Quốc gia, có vị trí xếp hạng ngày càng cao ở tầm thế giới và khu vực.   \n Trải qua 48 năm xây dựng và trưởng thành, Trường Đại học Kinh tế - ĐHĐN đã đào tạo cho đất nước gần 60 nghìn cử nhân và hàng nghìn thạc sĩ, tiến sĩ. Quy mô đào tạo hàng năm gần 15 nghìn sinh viên, 19 ngành đào tạo bậc đại học, 7 ngành bậc thạc sĩ và 4 ngành đào tạo bậc tiến sĩ, là một trong các trường đại học hàng đầu trong đào tạo, nghiên cứu khối ngành Kinh tế, Kinh doanh và quản lý và cũng là một trong hơn 20 trường thực hiện tự chủ đại học trong cả nước.\n Trường Đại học Kinh tế, ĐHĐN đã luôn giữ vững là trường đại học hàng đầu trong đào tạo, nghiên cứu khoa học, khẳng định được vị trí tiên phong trong công cuộc đổi mới nền giáo dục nước nhà. Trong thời gian tới, Nhà trường luôn mở rộng cơ hội, từng bước đột phá mới, biến những thách thức thành cơ hội và luôn nỗ lực hơn nữa để nhà trường ngày càng phát triển lên một tầm cao mới.\n#DUE  #bithudanguy #Hoidongtruong #nghiquyet', 'Pachit Svdp']","['Tất cả, 110', 'Thích, 76', 'Yêu thích, 34']",[],130084,"Thứ Hai, 8 Tháng 1, 2024 lúc 09:21"
