content,emoji,comment,current,time
"[' [KÊU GỌI BÌNH CHỌN BÀI DỰ THI CUỘC THI SV.STARTUP LẦN THỨ VI CỦA SINH VIÊN DUE] \n--------------------------------------------------------------------------\n Cuộc thi “HỌC SINH, SINH VIÊN VỚI Ý TƯỞNG KHỞI NGHIỆP” LẦN THỨ VI – SV.STARTUP là một cuộc thi được Bộ Giáo dục và Đào tạo tổ chức nhằm không ngừng nâng cao tinh thần khởi nghiệp của sinh viên; lựa chọn ý tưởng, dự án khởi nghiệp khả thi, kết nối với các đơn vị hỗ trợ khởi nghiệp của các cơ sở giáo dục, thúc đẩy phát triển khởi nghiệp của sinh viên. \n Nhóm sinh viên đến từ khoa Quản trị Kinh Doanh đã vinh dự đại diện trường Đại học Kinh tế - ĐHĐN bước vào Vòng bình chọn với sản phẩm SULE- Vòng tay cảnh báo hen suyễn. Khoa QTKD kính mời Quý Thầy cô và sinh viên cùng tham gia bình chọn cho sản phẩm của đội thi. \n Thời gian: Từ 12h ngày 19/02/2024 đến hết 12h ngày 09/03/2024 \n Cách thức theo 04 bước: \nBước \n: Vào link bài dự thi: http://due.udn.vn/vi-vn/thongbao/thongbaochitiet/id/18559\nBước \n: Nhấn “Bình chọn dự án” \nBước \n: Cho điểm (5 điểm/mỗi tiêu chí) \nBước \n: Nhập họ tên + gmail + rồi nhấn “Đánh giá”. Nhập mã vào ô (mã được gửi tại gmail của bạn).\n Xin cảm ơn quý Thầy cô và các bạn đã quan tâm. Mỗi lượt bình chọn sẽ là nguồn động lực to lớn giúp nhóm đi xa hơn trong cuộc thi!\n#DUE #sinhvien #khoinghiep', 'Sang Sang']","['Tất cả, 33', 'Thích, 25', 'Yêu thích, 8']",[],48902,"Thứ Hai, 26 Tháng 2, 2024 lúc 10:01"
"['[CÁC PHƯƠNG TIỆN THÔNG TIN ĐẠI CHÚNG ĐƯA TIN VỀ TALKSHOW ""KHỞI NGHIỆP CÙNG SHARK HÙNG ANH""]\n Diễn ra vào chiều 24/2, Talkshow ""Khởi nghiệp cùng Shark Hùng Anh"" do Trường Đại học Kinh tế tổ chức đã thu hút sự tham gia của đông đảo sinh viên trên địa bàn thành phố. Các phương tiện thông tin đại chúng đã quan tâm và đưa tin về Talkshow:\n- Báo Tiền phong: https://tienphong.vn/shark-hung-anh-truyen-cam-hung-khoi...\n- Thông tấn xã Việt Nam: https://vnanet.vn/.../khoi-day-tinh-than-khoi-nghiep-cho...\n- Báo Giáo dục thời đại: https://giaoducthoidai.vn/shark-le-hung-anh-khuyen-sv...\n- Đài Phát thanh - Truyền hình Đà Nẵng: https://www.facebook.com/danangtv.vn/videos/730950552144504/\n- Tạp chí Đông Nam Á: https://seatimes.com.vn/chuyen-gia-khoi-nghiep-le-hung.../\n- Báo Tuổi trẻ Thủ đô: https://tuoitrethudo.com.vn/shark-hung-anh-chia-se-ve...\n- Báo Công an Đà Nẵng: https://cadn.com.vn/shark-hung-anh-truyen-cam-hung-khoi...\n- Đài Phát thanh - Truyền hình Quảng Nam: https://www.youtube.com/watch?v=96pR3fEe4p4\n#DUE #talkshow #BIN #group']","['Tất cả, 48', 'Thích, 38', 'Yêu thích, 10']",[],50405,"Chủ Nhật, 25 Tháng 2, 2024 lúc 19:01"
"['[CHƯƠNG TRÌNH TƯ VẤN MÙA THI NĂM 2024: TẠO LỢI THẾ TRONG XÉT TUYỂN, TĂNG CƠ HỘI ĐẬU VÀO DUE]\n Tiếp nối với chương trình buổi sáng, chương trình buổi chiều của “Tư vấn mùa thi năm 2024” của báo Thanh niên tổ chức cũng vô cùng hấp dẫn với nhiều thông tin bổ ích cho học sinh trên địa bàn thành phố.\n Mở màn là tiết mục “Sóng tuổi trẻ” do đội văn nghệ DUE đã mang để tinh thần hứng khởi và sự sôi động cho các bạn trẻ team #2K6, thể hiện môi trường năng động, sáng tạo và đầy nhiệt huyết của tuổi trẻ DUE!\n Cùng hiện diện tại chương trình, PGS.TS. Đoàn Ngọc Phi Anh – Phó Hiệu trưởng Trường Đại học Kinh tế - Đại học Đà Nẵng cũng nhận được khá nhiều câu hỏi trực tiếp từ các bạn thí sinh. Đối với thắc mắc về các chương trình du học tại chỗ của Trường, PGS.TS. Đoàn Ngọc Phi Anh cho biết hiện trường đang xét tuyển chương trình Cử nhân chính quy quốc tế đối với thí sinh có IELTS từ 5.5 hoặc TOEFL iBT từ 46 điểm trở lên. Đây là chương trình du học tại chỗ được nhiều phụ huynh, học sinh lựa chọn với hình thức chuyển tiếp 2+2, 3+1, liên kết với các đối tác uy tín trên toàn cầu như: Swinbure University of Technology (Úc), City University of Seattle (Hoa Kỳ), Herriot-Watt University (Anh quốc), Lincoln University (New Zealand).v.v… Ngoài ra, đối với 2 chương trình đào tạo chính quy là Kinh doanh quốc tế và Marketing số, thí sinh cũng có thêm lựa chọn được học tập hoàn toàn bằng tiếng Anh nếu đảm bảo các điều kiện ngoại ngữ đầu vào.\nBạn Ngọc Châu (THPT Hoàng Hoa Thám) cũng gửi câu hỏi đến đại diện Trường Đại học Kinh tế là thí sinh nên đăng ký xét tuyển như thế nào để tăng lợi thế trong quá trình xét tuyển vào trường? PGS.TS. Đoàn Ngọc Phi Anh giải thích thí sinh hoàn toàn có thể xét tuyển đồng thời nhiều phương thức để tăng cơ hội đậu vào các ngành của trường với mã trường DDQ.\n Bên cạnh đó, đại diện Trường Đại học Kinh tế cũng giới thiệu điểm mới trong tuyển sinh của Trường năm 2024 là tích hợp chứng chỉ nghề nghiệp quốc tế Anh Quốc (ACCA) trong chương trình cử nhân Kiểm toán. Từ đó, thí sinh tốt nghiệp sẽ có cơ hội việc làm về ngành nghề kiểm toán trên toàn cầu với chứng chỉ quốc tế.\n Chương trình Tư vấn mùa thi 2024 do báo Thanh niên tổ chức sẽ tiếp tục vào Chủ nhật tới (ngày 03/3) tại Trường Quốc tế Sky-line Hill (Điện Bàn, Quảng Nam). Đừng bỏ lỡ những thông tin bổ ích về tuyển sinh cũng như cơ hội gặp gỡ, tư vấn với các thầy cô đến từ DUE nhé!\n  Mã trường: 𝐃𝐃𝐐\n  Những #điểm_nhấn trong tuyển sinh năm 2024 mà team #2K6 không thể bỏ qua:\n Chương trình cử nhân Kiểm toán tích hợp chứng chỉ nghề nghiệp quốc tế Anh Quốc (ACCA)\n 02 ngành/chuyên ngành có chương trình đào tạo 100% bằng tiếng Anh: #kinh_doanh_quốc_tế và #marketing_số\n Thêm lựa chọn học trao đổi 1-2 học kỳ với 10 trường đào tạo kinh tế hàng đầu Việt Nam\n Cơ hội sở hữu cùng lúc 02 bằng đại học với cơ chế đào tạo linh hoạt của DUE \n Học #thạc_sĩ ngay trong chương trình đào tạo đào tạo đại học\n Rút ngắn lộ trình chinh phục tấm bằng #thạc_sĩ\n Tham gia Tuyển sinh Đại học Kinh tế Đà Nẵng- DUE: www.fb.com/groups/tuyensinhddq để cập nhật thông tin tuyển sinh mới nhất!\n-------------\n CALL NOW \n 0911 223 777 - 02363 522345\nTruy cập: http://tuyensinh.due.udn.vn\n Inbox Trường Đại học Kinh tế - Đại học Đà Nẵng để được tư vấn, giải đáp thắc mắc\n-------------\n#DUE #tuyensinh #tuyensinh2024 #tuvantuyensinh #xettuyen #tuyenthang #cunhan #chinhquy #quocte #thanhtichhoctap #nanglucngoaingu #hocsinhgioi #IELTS #TOEFLiBT #xethocba #danhgianangluc #diemthiTHPT']","['Tất cả, 69', 'Thích, 51', 'Yêu thích, 18']",[],51523,"Chủ Nhật, 25 Tháng 2, 2024 lúc 16:43"
"['[NIỀM VUI HÂN HOAN NGÀY LỄ TỐT NGHIỆP]\n Hành trang trong tương lai của chúng ta sẽ là những kỷ niệm khó quên của những năm tháng miệt mài đèn sách dưới mái Trường Đại học Kinh tế - ĐHĐN, là những gian lao vất vả học tập ngày hôm qua, là bản lĩnh của ngày hôm nay, và là niềm tin về sự thành công trong nghề nghiệp và hạnh phúc trong cuộc sống của ngày mai. Trong buổi sáng ngày 25/2, Trường Đại học Kinh tế - ĐHĐN long trọng tổ chức Lễ trao bằng tốt nghiệp đại học chính quy - đợt 1 năm 2024 cho 150 Tân cử nhân tài năng. \nTốt nghiệp Đại học chỉ là khởi đầu của một chặng đường mới, nhưng chúng ta tin tưởng rằng dưới sự dìu dắt học tập của thầy cô và sự đào tạo chất lượng từ trường Đại học Kinh tế ĐHĐN, các Tân cử nhân sẽ có bệ phóng vững chắc giúp cho ước mơ bay cao, bay xa hơn nữa. Ngày lễ Trao bằng tốt nghiệp là một trong những ngày rất đặc biệt mà chắc chắn các bạn sinh viên sẽ không bao giờ quên.\n Phát biểu chúc mừng các tân cử nhân, PGS.TS Đoàn Ngọc Phi Anh - Phó Hiệu trưởng Trường Đại học Kinh tế - ĐHĐN nhận định: Nhìn lại quãng đường trong những năm qua, trên hành trình dạy và học, thầy và trò Nhà trường không chỉ vượt qua những thách thức mà còn phát triển mạnh mẽ hơn và trở nên thích ứng hơn. Chúng ta bắt buộc phải linh hoạt hơn trước những thách thức của môi trường kinh tế xã hội đang biến động nhanh chóng. Nhà trường đã không ngừng đổi mới trong phương thức quản lý, liên tục cập nhật chương trình đào tạo. Đây không chỉ là sự đáp ứng đúng đắn trước sự biến động mạnh mẽ của công nghệ mà còn là cơ hội để chúng ta định hình và dẫn dắt xu hướng phát triển của thị trường lao động trong tương lai. \n Hãy để ngày hôm nay không phải là sự kết thúc của một chương sách học thuật, mà là sự khởi đầu của một hành trình mới đầy hứng thú. Hãy cùng nhau tạo nên những câu chuyên thành công mới, hãy trở thành niềm tự hào không chỉ cho bản thân mình mà của cộng đồng cựu sinh viên DUE, đồng thời tự hào về đóng góp tích cực của mình vào sự phồn thịnh và phát triển của Nhà trường. \n#DUE, #totnghiep, #daihocchinhquy']","['Tất cả, 175', 'Thích, 125', 'Yêu thích, 50']",[],53718,"Chủ Nhật, 25 Tháng 2, 2024 lúc 11:26"
"['[CHƯƠNG TRÌNH TƯ VẤN MÙA THI NĂM 2024 BÁO THANH NIÊN]\n Sáng nay, Chương trình tư vấn mùa thi năm 2024 của Báo Thanh niên đã chính thức khai mạc tại Trường THPT Phan Châu Trinh (Đà Nẵng) với sự tham gia của gần 5000 học sinh THPT trên địa bàn thành phố.\n Tại buổi khai mạc chương trình Tư vấn mùa thi năm 2024, học sinh đã được cung cấp thông tin chính thức từ Bộ GD-ĐT về kỳ thi tốt nghiệp THPT và tuyển sinh ĐH; thông tin về ngành nghề, lao động việc làm, cơ hội nghề nghiệp; giải đáp một số thắc mắc của thí sinh về tuyển sinh, học tập ở bậc ĐH.\n Sôi nổi các hoạt động tư vấn tại gian tuyển sinh của Trường Đại học Kinh tế, các tư vấn viên cũng như thầy cô Trường Đại học Kinh tế đã tư vấn về các phương thức xét tuyển của Trường. Cụ thể, năm 2024, Trường Đại học Kinh tế ổn định phương án tuyển sinh với 5 phương thức xét tuyển: (1) Xét tuyển thẳng, (2) Xét tuyển theo Thành tích học tập & Năng lực ngoại ngữ, (3) Xét tuyển theo thành tích học tập THPT, (4) Xét tuyển theo thành tích kỳ thi Đánh giá năng lực năm 2024 do ĐHQG TP Hồ Chí Minh tổ chức, (5) Xét tuyển theo kết quả kỳ thi tốt nghiệp THPT năm 2024. Thông tin tuyển sinh được cập nhật tại Cổng thông Tin TVTS của Trường: http://tuyensinh.due.udn.vn/\n Ngoài ra, các thầy cô đến từ các khoa cũng tư vấn chuyên sâu về lựa chọn ngành học phù hợp với năng lực, sở thích của bản thân, bên cạnh đó cơ hội việc làm của các chuyên ngành cũng được giới thiệu để team #2K6 hình dung về nghề nghiệp trong tương lai. Đặc biệt, trong bối cảnh chuyển đổi số, một số ngành học của DUE đã được team #2K6 dành sự quan tâm như: Công nghệ tài chính, Khoa học dữ liệu, Kinh doanh số, Thương mại điện tử, Hệ thống thông tin quản lý, Marketing số.v.v…\n Chương trình sẽ tiếp tục diễn ra vào chiều nay (25/2), cùng đến với gian tuyển sinh của DUE để được định hướng đúng đắn về tương lai nhé team #2K6!\n  Mã trường: 𝐃𝐃𝐐\n  Những #điểm_nhấn trong tuyển sinh năm 2024 mà team #2K6 không thể bỏ qua:\n Chương trình cử nhân Kiểm toán tích hợp chứng chỉ nghề nghiệp quốc tế Anh Quốc (ACCA)\n 02 ngành/chuyên ngành có chương trình đào tạo 100% bằng tiếng Anh: #kinh_doanh_quốc_tế và #marketing_số\n Thêm lựa chọn học trao đổi 1-2 học kỳ với 10 trường đào tạo kinh tế hàng đầu Việt Nam\n Cơ hội sở hữu cùng lúc 02 bằng đại học với cơ chế đào tạo linh hoạt của DUE\n Học #thạc_sĩ ngay trong chương trình đào tạo đào tạo đại học\n Rút ngắn lộ trình chinh phục tấm bằng #thạc_sĩ\n Tham gia Tuyển sinh Đại học Kinh tế Đà Nẵng- DUE: www.fb.com/groups/tuyensinhddq để cập nhật thông tin tuyển sinh mới nhất!\n-------------\n CALL NOW \n 0911 223 777 - 02363 522345\nTruy cập: http://tuyensinh.due.udn.vn\n Inbox Trường Đại học Kinh tế - Đại học Đà Nẵng để được tư vấn, giải đáp thắc mắc\n-------------\n#DUE #tuyensinh #tuyensinh2024 #tuvantuyensinh #xettuyen #tuyenthang #cunhan #chinhquy #quocte #thanhtichhoctap #nanglucngoaingu #hocsinhgioi #IELTS #TOEFLiBT #xethocba #danhgianangluc #diemthiTHPT', 'Sơn Nhật\nQuan tâm xin được tư vấn']","['Tất cả, 109', 'Thích, 70', 'Yêu thích, 37', 'Thương thương, 1', 'Haha, 1']",[],55185,"Chủ Nhật, 25 Tháng 2, 2024 lúc 09:56"
"['[TALKSHOW ""KHỞI NGHIỆP CÙNG SHARK HÙNG ANH"" - NHỮNG CÂU CHUYỆN THÚ VỊ, ĐẦY CẢM HỨNG ĐƯỢC TÍCH LŨY TỪ HÀNH TRÌNH KHỞI NGHIỆP ĐẦY ""MÀU SẮC""]\nChiều ngày 24/2, Trường Đại học Kinh tế - Đại học Đà Nẵng phối hợp với Tập đoàn BIN Corporation tổ chức Chương trình Talkshow ""Khởi nghiệp cùng Shark Hùng Anh"" để giúp các bạn sinh viên có thể học hỏi thêm được những kinh nghiệm và kiến thức bổ ích về khởi nghiệp. Chương trình thu hút hơn 300 sinh viên tham gia và được thực hiện trên cả hai nền tảng trực tiếp và trực tuyến.\nTham gia chương trình này, các bạn sinh viên có cơ hội được gặp gỡ ông Lê Hùng Anh - Founder & CEO tại Tập đoàn BIN Corporation, được lắng nghe những chia sẻ của diễn giả về các kiến thức/ kỹ năng/ thái độ mà sinh viên, học viên cần ghi nhớ, cần phát triển trước khi bắt đầu hành trình khởi nghiệp? cũng như những nhân tố quyết định sự thành công và thất bại của một dự án khởi nghiệp? Có sự chuyển dịch so với khởi nghiệp truyền thống hay không? Những quyết định khởi nghiệp thường sẽ mang những đặc trưng nào, và trong kỷ nguyên mới này, quyết định khởi nghiệp sẽ có những khác biệt nào? Vai trò của nền tảng mạng xã hội trong chiến lược digital marketing hiện đại? Đặc biệt, diễn giả có lời khuyên và chia sẻ gì gửi các bạn trẻ đã và đang có ý định khởi nghiệp?...\n Shark Lê Hùng Anh đưa ra những lời khuyên rằng, mỗi bạn sinh viên cần phải có nền tảng vững chắc trước khi đi làm và khuyên các bạn không nên bỏ học. Shark Hùng Anh cũng mong muốn rằng, các bạn muốn tham gia khởi nghiệp, muốn có một cuộc sống tương lai tốt đẹp hơn nhưng khi làm gì chúng ta cần có suy nghĩ chín chắn, cẩn thận và đi trên con đường tương đối an toàn, bền vững và nỗ lực. Tiền sẽ tới, tinh thần sẽ tới, các mối quan hệ sẽ tới và tất cả những điều tốt đẹp sẽ tới nếu chúng ta nỗ lực hết mình vì bản thân và vì giá trị của xã hội.\n Với phần chia sẻ vô cùng đặc biệt của mình, Shark Lê Hùng Anh đã mang lại những góc nhìn sâu sắc cùng nhiều lời khuyên hữu ích. Những kinh nghiệm và bí quyết thành công của Shark chắc chắn sẽ giúp các bạn sinh viên có thêm động lực và kiến thức để phát triển bản thân trong tương lai. Hi vọng rằng Shark sẽ tiếp tục đồng hành cùng những startup trẻ, đem đến nhiều giá trị cho cộng đồng khởi nghiệp Việt Nam. \nChi tiết bài viết xem thêm tại: http://due.udn.vn/.../tintuc/tintucchitiet/id/18567/bid/455\n#khoinghiep, #doimoisangtao, #DUE, #BINGROUP', 'Viết bình luận...']","['Tất cả, 141', 'Thích, 108', 'Yêu thích, 32', 'Thương thương, 1']",[],57262,"Thứ bảy, 24 Tháng 2, 2024 lúc 20:04"
"['KHỞI NGHIỆP CÙNG SHARK HÙNG ANH\nChiều 24/2, Trường Đại học Kinh tế - Đại học Đà Nẵng tổ chức Talkshow  “Khởi nghiệp cùng Shark Hùng Anh”. Chương trình thu hút hơn 300 sinh viên có niềm đam mê với khởi nghiệp sáng tạo, mong muốn tham gia để giao lưu, gặp gỡ và truyền cảm hứng từ diễn giả có uy tín trong lĩnh vực về khởi nghiệp, đổi mới, sáng tạo trong thời đại mới - Shark Lê Hùng Anh. ', 'KHỞI NGHIỆP CÙNG SHARK HÙNG ANH\nChiều 24/2, Trường Đại học Kinh tế - Đại học Đà Nẵng tổ chức Talkshow  “Khởi nghiệp cùng Shark Hùng Anh”. Chương trình thu hút hơn 300 sinh viên có niềm đam mê với khởi nghiệp sáng tạo, mong muốn tham gia để giao lưu, gặp gỡ và truyền cảm hứng từ diễn giả có uy tín trong lĩnh vực về khởi nghiệp, đổi mới, sáng tạo trong thời đại mới - Shark Lê Hùng Anh. ', 'Viết bình luận...']","['Tất cả, 66', 'Thích, 48', 'Yêu thích, 17', 'Thương thương, 1']",[],58934,"Thứ bảy, 24 Tháng 2, 2024 lúc 19:25"
"['[DUE VÀ TẬP ĐOÀN BIN CORPORATION KÝ KẾT THỎA THUẬN HỢP TÁC, ĐẨY MẠNH CÔNG TÁC ĐÀO TẠO NGUỒN NHÂN LỰC CHẤT LƯỢNG CAO]\n️\nTrường Đại học Kinh tế - ĐHĐN và Tập đoàn BIN Corporation ký kết thỏa thuận hợp tác vào chiều ngày 24/2 nhằm đẩy mạnh, phát huy năng lực và thế mạnh của mỗi bên, khai thác và tận dụng hiệu quả các tiềm năng về cơ sở vật chất, con người, kinh nghiệm chuyên môn trong việc đào tạo nguồn nhân lực chất lượng cao.\n Tin tưởng vào sự hợp tác đầy triển vọng giữa hai bên, PGS.TS. Lê Văn Huy - Hiệu trưởng Nhà trường nhấn mạnh: DUE cam kết sẽ triển khai hiệu quả các nội dung theo thỏa thuận hợp tác và mong muốn rằng, phía Tập đoàn BIN Corporation sẽ tích cực hỗ trợ nhà trường trong các hoạt động như xây dựng chương trình đào tạo, tổ chức các hoạt động ngoại khóa, thực tập, tài trợ học bổng… \n Ghi nhận và đánh giá cao trong việc hợp tác giữa Trường Đại học Kinh tế - ĐHĐN và Tập đoàn BIN Corporation, ông Lê Hùng Anh mong muốn rằng việc ký kết hợp tác lần này sẽ giúp hai bên tận dụng và chia sẻ nguồn lực để cùng nhau phát triển, đẩy mạnh đào tạo nguồn nhân lực chất lượng cao và tiến tới các hợp tác lâu dài hơn nữa trong tương lai.  \nTheo đó, Trường Đại học Kinh tế - ĐHĐN đạt được thỏa thuận hợp tác với Tập đoàn BIN Corporation về phối hợp trong quá trình đào tạo sinh viên trong các ngành quản trị, tài chính, Marketing, thương mại điện tử, du lịch,... của Trường Đại học Kinh tế - Đại học Đà Nẵng nhằm nâng cao trình độ và kỹ năng chuyên môn, nghề nghiệp cho sinh viên theo hướng đáp ứng tốt hơn yêu cầu của thị trường lao động và hội nhập quốc tế. Từ đó, mang lại lợi ích thiết thực cho hai bên trong quá trình đào tạo và góp phần nâng cao trình độ chuyên môn nghiệp vụ cho cán bộ của cả hai bên. \nChi tiết bài viết xem thêm tại link: http://due.udn.vn/.../tintuc/tintucchitiet/id/18566/bid/455\n#Kyket, #DUE, #BIGROUP, #Marketing, #thuongmaidientu']","['Tất cả, 203', 'Thích, 138', 'Yêu thích, 65']",[],59951,"Thứ bảy, 24 Tháng 2, 2024 lúc 18:06"
"[' Thời gian: 14h30 – 16h30, ngày 24/02/2024.\n Địa điểm: Hội trường A, Trường Đại học Kinh tế - Đại học Đà Nẵng. \n Chương trình Talkshow sẽ được phát sóng trực tiếp vào chiều thứ Bảy, ngày 24/2/2024 trên các kênh:\n Fanpage Trường Đại học Kinh tế - Đại học Đà Nẵng: https://www.facebook.com/FaceDue/\n Kênh youtube DUE TV: https://www.youtube.com/@DUETV\n Fanpage Đài Phát thanh - Truyền hình Đà Nẵng: https://www.facebook.com/danangtv.vn\n Fanpage Đoàn Thanh niên - Hội Sinh viên Trường Đại học Kinh tế: https://www.facebook.com/youthdue \n Fanpage Startup Runway DUE: https://www.facebook.com/StartupRunwayDUE\n#DUE #talkshow #sinhvien #khoinghiep', 'Ca Kiu\nTuyệt vời']","['Tất cả, 814', 'Thích, 519', 'Yêu thích, 286', 'Thương thương, 5', 'Haha, 2', 'Wow, 2']",[],61418,"Thứ bảy, 24 Tháng 2, 2024 lúc 14:32"
"['[ĐẾM NGƯỢC TRƯỚC BUỔI GẶP GỠ VỚI SHARK HÙNG ANH]\n Vậy là chỉ còn vài giờ nữa thôi, các bạn sinh viên sẽ được gặp gỡ với một trong những Shark đang hot của chương trình @Shark Tank Việt Nam, một chuyên gia dày dặn kinh nghiệm trong lĩnh vực khởi nghiệp, một người con xứ Quảng luôn tâm huyết với dự án khởi nghiệp của giới trẻ: Shark Lê Hùng Anh.\n Đừng bỏ lỡ sự kiện đáng mong chờ nhất của DUE trong đầu năm 2024 này nhé!\n Thời gian: 14h30 – 16h30, ngày 24/02/2024.\n Địa điểm: Hội trường A, Trường Đại học Kinh tế - Đại học Đà Nẵng. \n Chương trình Talkshow sẽ được phát sóng trực tiếp vào chiều thứ Bảy, ngày 24/2/2024 trên các kênh:\n Fanpage Trường Đại học Kinh tế - Đại học Đà Nẵng: https://www.facebook.com/FaceDue/\n Kênh youtube DUE TV: https://www.youtube.com/@DUETV\n Fanpage Đài Phát thanh - Truyền hình Đà Nẵng: https://www.facebook.com/danangtv.vn\n Fanpage Đoàn Thanh niên - Hội Sinh viên Trường Đại học Kinh tế: https://www.facebook.com/youthdue \n Fanpage Startup Runway DUE: https://www.facebook.com/StartupRunwayDUE\n#DUE #talkshow #sinhvien #khoinghiep', 'Tân Tom\nLê Bảo Lê Bảo Ngọc coi sắp xếp thời gian mà than gia\nRất hữu ích']","['Tất cả, 154', 'Thích, 108', 'Yêu thích, 43', 'Thương thương, 3']",[],62388,"Thứ bảy, 24 Tháng 2, 2024 lúc 08:30"
