content,emoji,comment,current,time
"['️\nHỘI NGHỊ CÔNG BỐ NGHỊ QUYẾT BỔ NHIỆM PHÓ HIỆU TRƯỞNG VÀ CÁC QUYẾT ĐỊNH VỀ CÔNG TÁC CÁN BỘ️\nSáng ngày 01/2, Trường Đại học Kinh tế, ĐHĐN tổ chức Hội nghị Công bố Nghị quyết bổ nhiệm Phó Hiệu trưởng đối với PGS.TS. Đoàn Ngọc Phi Anh và các Quyết định về Công tác cán bộ đối với lãnh đạo các đơn vị: Phòng Tổ chức - Hành chính, Phòng Khảo thí và Đảm bảo chất lượng giáo dục, Khoa Thống kê - Tin học và Khoa Quản trị kinh doanh. \nPhát biểu tại buổi lễ, PGS.TS. Nguyễn Mạnh Toàn chúc mừng tân phó Hiệu trưởng và các cán bộ lãnh đạo đã nhận được sự tín nhiệm cao của cán bộ viên chức, cán bộ chủ chốt và tập thể Đảng ủy nhà trường. PGS.TS. Nguyễn Mạnh Toàn khẳng định: Tập thể nhà trường tin tưởng rằng các thầy cô sẽ phát huy hết năng lực, đóng góp công sức và trí tuệ vào sự phát triển của nhà trường. Chúc mừng các thầy cô hoàn thành xuất sắc nhiệm vụ trên cương vị mới, đáp ứng nhu cầu của sinh viên và góp phần tích cực vào sự thịnh vượng của Nhà trường.\n️\nPhát biểu giao nhiệm vụ cho các nhân sự được bổ nhiệm, PGS. TS. Lê Văn Huy - Hiệu trưởng Nhà trường nhận định: “Đây là sự kiện quan trọng trong sự phát triển chung của nhà trường. Tân Phó Hiệu trưởng và các cán bộ được bổ nhiệm ngày hôm nay đều được đào tạo bài bản, tác phong mẫu mực, tinh thần làm việc nghiêm túc. Hi vọng rằng, các thầy cô sẽ thể hiện khả năng và trí tuệ của mình để cùng nhau xây dựng tập thể Trường Đại học Kinh tế - ĐHĐN vững mạnh, đoàn kết. Hiệu trưởng Nhà trường khẳng định, tập thể DUE sẽ tiếp tục phát huy truyền thống đoàn kết, thống nhất, quyết tâm phấn đấu, thể hiện đúng tinh thần theo định hướng về sứ mệnh, tầm nhìn và giá trị cốt lõi đã đề ra.\nĐại diện các nhân sự được bổ nhiệm phát biểu nhận nhiệm vụ, PGS.TS. Đoàn Ngọc Phi Anh - Tân phó Hiệu trưởng cho biết: Chúng tôi nhận thức sâu sắc rằng, mỗi nhiệm vụ mới luôn đối mặt với những khó khăn mới, thách thức mới và cơ hội mới. Với niềm vinh dự, tự hào và tinh thần trách nhiệm cao nhất vì mái nhà chung DUE, trước các đồng chí lãnh đạo Đại học Đà Nẵng, lãnh đạo Nhà trường, trước các thầy cô và cán bộ viên chức, chúng tôi xin hứa sẽ không ngại khó khăn, thử thách, toàn tâm - toàn ý vì công việc chung của Trường, thực hiện chương trình hành động đã đề ra, khiêm tốn lắng nghe, học hỏi, trân trọng và tiếp tục phát huy những thành quả của những người tiền nhiệm, luôn cố gắng hết mình làm việc với nhiệt huyết, luôn nêu cao tinh thần đoàn kết, phối hợp hiệu quả trong mọi hoạt động để hoàn thành tốt tất cả nhiệm vụ được giao, để không phụ sự tin tưởng của tập thể vì một DUE phát triển bền vững.\nChi tiết bài viết xem thêm tại link: http://due.udn.vn/.../tintuc/tintucchitiet/id/18536/bid/455\n#DUE. #Congbo, #bonhiem', 'Võ Tấn Hải\nChúc mừng ông ạ']","['Tất cả, 179', 'Thích, 132', 'Yêu thích, 45', 'Thương thương, 2']",[],93135,"Thứ Năm, 1 Tháng 2, 2024 lúc 13:48"
['Trường Đại học Kinh tế - Đại học Đà Nẵng · Âm thanh gốc'],[],[],94896,"Thứ Tư, 31 Tháng 1, 2024 lúc 11:04"
"[""[BÁO GIÁO DỤC & THỜI ĐẠI: NHIỀU GIÁ TRỊ CỘNG THÊM TỪ THU HÚT SINH VIÊN QUỐC TẾ]\nĐa dạng hóa quốc tịch của sinh viên sẽ góp phần tạo môi trường đa văn hóa, thúc đẩy quốc tế hóa đại học.\nSinh viên Esteban (Trường Đại học Côte d’Azur, Cộng hòa Pháp) đã chọn học tập trao đổi ngành tại Marketing Trường ĐH Kinh tế, ĐH Đà Nẵng cho biết: “Tôi đến từ Pháp và tôi chưa đi du lịch nhiều.Trường đại học của tôi ở Pháp cung cấp chương trình trao đổi sang Canada, Croatia hoặc bất kỳ nơi nào ở Châu Âu. Nhưng tôi chọn Việt Nam để trải nghiệm về văn hóa, vì châu Âu vẫn có môi trường khá giống nhau giữa các quốc gia”. Esteban đặc biệt thích khám phá ẩm thực, kiến trúc, cảnh quan và lịch sử của Việt Nam.\nChia sẻ cảm xúc khi học tại Trường ĐH Kinh tế, ĐH Đà Nẵng, Esteban vui vẻ cho biết: “Tôi rất được chào đón khi đến Việt Nam. Bộ phận hỗ trợ sinh viên đã giới thiệu cho tôi một số căn hộ để lựa chọn. Khi bắt đầu học tập tại Trường ĐH Kinh tế, ĐH Đà Nẵng, tôi rất lo lắng nhưng cuối cùng thì các giảng viên đều rất tốt, nói tiếng Anh tốt và các bạn cùng lớp cũng rất tốt với tôi”.\nTheo nhận xét của Esteban, cách tổ chức các khóa học của Trường ĐH Kinh tế, ĐH Đà Nẵng khá giống với Pháp. Ngoài học trực tiếp, vẫn duy trì hình thức học trực tuyến nên giúp ích rất nhiều cho việc ôn tập, làm việc nhóm, kiểm tra... “Giảng viên luôn trả lời các câu hỏi của tôi và luôn sẵn sàng trả lời email của tôi. Việc chấm bài cũng rất công bằng. Tôi rất thích trò chuyện với giảng viên của Nhà trường”.\nTừ những trải nghiệm của bản thân trong thời gian học trao đổi tại Trường ĐH Kinh tế, ĐH Đà Nẵng, Esteban cho biết mình đang giới thiệu cho những người bạn Pháp của mình. Và mong ngày càng nhiều sinh viên từ Đại học Nice Côte d'Azur ở Pháp sẽ tận dụng môi trường sống và học tập đặc biệt này để có những trải nghiệm văn hóa thú vị.\nCho Hanbe (người Hàn Quốc), hiện là sinh viên năm thứ 4, Khoa Kinh doanh quốc tế, Trường ĐH Kinh tế, ĐH Đà Nẵng. Cả gia đình Cho Hanbe chuyển đến Đà Nẵng sinh sống vì công việc của bố. Cho Hanbe chọn theo học đại học tại thành phố biển.\nTheo Cho Hanbe, lúc đầu, sinh viên ngoại quốc khó khăn để học ngôn ngữ mới và thích nghi tại môi trường mới. Nhưng thầy cô, bạn bè luôn sẵn lòng giúp đỡ, hỗ trợ; đồng thời các hoạt động chào đón sinh viên, học kỳ quân sự, ngày hội văn hóa, giao lưu thể thao… đã giúp Cho Hanbe cũng như các lưu học sinh tự tin hơn rất nhiều.\nXem thêm tại: https://giaoducthoidai.vn/nhieu-gia-tri-cong-them-tu-thu...\n#DUE #sinhvien #quocte #traodoi""]","['Thích, 21']",[],95412,"Thứ Hai, 29 Tháng 1, 2024 lúc 19:21"
"['  Cùng điểm xem tuần qua nhà DUE có những tin tức – sự kiện nổi bật nào nhé:\n DUE và LPBANK ký kết thỏa thuận hợp tác, phát huy thế mạnh trên nhiều lĩnh vực\n Ngày hội văn hóa dân gian Trường THPT Nguyễn Văn Thoại (Đà Nẵng): Sẵn sàng cho hành trang tương lai\n Không ngừng phấn đấu hướng tới danh hiệu Sinh viên 5 tốt tiêu biểu cấp Trung ương\n Chương trình hiến máu nhân đạo “Chủ Nhật Đỏ” đợt 1 năm 2024\n#DUE #news #tintuc #sukien', 'Viết bình luận...']","['Tất cả, 31', 'Thích, 26', 'Yêu thích, 5']",[],96882,"Thứ Hai, 29 Tháng 1, 2024 lúc 14:42"
"['[RỘN RÀNG NGÀY HỘI VĂN HÓA DÂN GIAN, SẴN SÀNG HÀNH TRANG CHO TƯƠNG LAI]\n Sân trường Trường THPT Nguyễn Văn Thoại (TP Đà Nẵng) sáng nay rộn ràng với các hoạt động của Ngày hội văn hóa dân gian. Ngày hội đã tái hiện không khí chợ Tết truyền thống của dân tộc, nhiều chủ đề của ngôi trại rất ấn tượng được các em học sinh lên ý tưởng và thiết kế, thi công hay những bộ trang phục sặc sỡ của các dân tộc đại diện các vùng miền.\n Một hoạt động thú vị tại ngày hội chính là chương trình tư vấn, định hướng nghề nghiệp của các trường đại học trên địa bàn TP Đà Nẵng dành cho các bạn trẻ. Tại gian tư vấn tuyển sinh của Trường Đại học Kinh tế, tuổi trẻ THPT Nguyễn Văn Thoại đã được cung cấp nhiều thông tin tuyển sinh bổ ích của Nhà trường, đồng thời được đội ngũ tư vấn định hướng nghề nghiệp đúng đắn trước kỳ tuyển sinh đại học năm 2024 sắp đến.\n Ngoài ra, các hoạt động giao lưu với tuổi trẻ Trường Đại học Kinh tế đã đem đến cái nhìn mới mẻ cho tuổi trẻ THPT Nguyễn Văn Thoại về môi trường học tập, môi trường hoạt động Đoàn – Hội năng động, sôi nổi bậc nhất miền Trung – Tây Nguyên. Tại Trường Đại học Kinh tế, sinh viên có cơ hội phát huy năng lực, rèn luyện các kĩ năng và tham gia các hoạt động, cuộc thi được tổ chức phong phú, góp phần đem lại giá trị tích cực cho cộng đồng xã hội như: Green University DUE, Tình nguyện Hè – Tình nguyện Đông, Dự án Chuyến bay 71, Startup Runway và vô vàn các hoạt động thiện nguyện.v.v....\n Các chủ đề về hướng nghiệp cũng được tuổi trẻ THPT Nguyễn Văn Thoại quan tâm như: lựa chọn ngành học phù hợp với khả năng của bản thân, những chính sách ưu đãi, các chương trình học bổng, cơ hội du học, việc làm sau khi tốt nghiệp…Đây là những thông tin thực sự hữu ích đối với các em học sinh, giúp các em vững tin bước vào Kỳ thi tốt nghiệp THPT và có những sự lựa chọn đúng đắn cho bản thân. Đồng hành cùng thí sinh còn có đội ngũ tư vấn tuyển sinh thường trực trên Hotline: 02363 522345 - 0911 223 777, fanpage Trường Đại học Kinh tế - Đại học Đà Nẵng, Cổng thông tin tư vấn tuyển: http://tuyensinh.due.udn.vn. \n Chúc tuổi trẻ THPT Nguyễn Văn Thoại có ngày hôi văn hóa dân gian thật ý nghĩa và sẵn sàng hành trang cho tương lai phía trước!\n#DUE #tuyensinh #tuyensinhdaihoc #ngayhoi #vanhoa #dangian']","['Tất cả, 63', 'Thích, 54', 'Yêu thích, 9']",[],98055,"Thứ bảy, 27 Tháng 1, 2024 lúc 10:58"
"['[BÁO GIÁO DỤC & THỜI ĐẠI: TRAO ĐỔI SINH VIÊN MỚI Ở BƯỚC KHỞI ĐỘNG]\nCác trường đại học trong cùng khối ngành đã ký kết hợp tác song, đa phương về trao đổi sinh viên.\nHọc kỳ hè năm học 2022 - 2023, Trường Đại học Kinh tế, ĐH Đà Nẵng tiếp nhận 14 sinh viên đến từ Trường ĐH Kinh tế Quốc dân, Học viện Chính sách và phát triển tham gia 2 môn học Marketing và Giao tiếp kinh doanh. Trường cũng gửi 13 sinh viên vào Trường ĐH Kinh tế TP Hồ Chí Minh (nay là ĐH Kinh tế TP Hồ Chí Minh) tham gia học kỳ hè.\nTháng 10/2022, 10 cơ sở giáo dục đại học khối kinh tế đã ký kết thỏa thuận hợp tác trong đào tạo, nghiên cứu khoa học và đảm bảo chất lượng giáo dục. Một trong những nội dung ký kết là sinh viên có cơ hội được học tập trao đổi các khoá học ngắn và dài hạn ở những trường trong khối.\nTheo đó, ở khóa dài hạn cho phép người học các trường được đăng ký học tập, thực tập, nghiên cứu tại trường đối tác. Người học đăng ký tối đa 25 tín chỉ. Các học phần đăng ký phải có trong chương trình đào tạo của trường tiếp nhận. Người học được sắp xếp học tập, thực tập, nghiên cứu cùng người học của trường tiếp nhận trong các lớp học mở theo kế hoạch học tập của trường. Với khóa ngắn hạn, các trường đại học tổ chức học trong thời gian hè, công bố chương trình, nội dung khóa học và cho phép người học đăng ký học tập tối đa 12 tín chỉ.\nThực hiện trao đổi sinh viên, trước mỗi học kỳ, Trường ĐH Kinh tế, ĐH Đà Nẵng đều gửi thời khóa biểu dự kiến đến cho 9 trường còn lại trong khối trường đào tạo kinh tế. Dựa trên thời khóa biểu dự kiến này, sinh viên muốn tham gia chương trình trao đổi sẽ chọn lựa các môn học, cân đối số tín chỉ phù hợp để đăng ký tại trường mình đang học.\nPGS.TS Đoàn Ngọc Phi Anh - Trưởng phòng Đào tạo, Trường ĐH Kinh tế, ĐH Đà Nẵng cho biết: “Khi tiếp nhận sinh viên của trường đối tác, phòng sẽ hỗ trợ mở tài khoản để hoàn chỉnh việc đăng ký môn học, sắp xếp lớp sinh hoạt… Các công đoạn này được triển khai như tiếp nhận một sinh viên mới”. Học kỳ I năm học 2023 - 2024, có 2 sinh viên Học viện Ngân hàng đến học tại Trường ĐH Kinh tế, nhà trường gửi 7 sinh viên học chương trình trao đổi tại Trường ĐH Kinh tế Quốc dân.\nVõ Thị Thiên Ân (Trường ĐH Kinh tế, ĐH Đà Nẵng) - sinh viên tham gia môn học Mô phỏng kinh doanh tại ĐH Kinh tế TP Hồ Chí Minh (cơ sở Vĩnh Long) trong học kỳ hè vừa qua cho biết: “Ngoài giờ lên lớp, sinh viên liên kết được tham gia nhiều hoạt động do nhà trường tổ chức như cuộc thi Biztech Hackathon, áp dụng giải pháp công nghệ để giải quyết các vấn đề kinh tế, tham gia chiến dịch tình nguyện hè, thi ngoại ngữ…”.\nThiên Ân cùng các bạn trao đổi đến từ trường đào tạo kinh tế khác trong cả nước được bố trí ở tại ký túc xá nhà trường. Theo Thiên Ân, học kỳ hè của chương trình liên kết là cơ hội để trải nghiệm môi trường học tập khác, kết nối thêm bạn bè ở nhiều trường học trên cả nước.\nPGS.TS Đoàn Ngọc Phi Anh - Trưởng phòng Đào tạo Trường ĐH Kinh tế, ĐH Đà Nẵng cho biết: “Phòng Đào tạo thường phải tư vấn kỹ cho sinh viên trong lựa chọn môn học, số lượng tín chỉ để thuận lợi việc công nhận kết quả học tập ở trường đối tác. Việc sinh viên muốn tham gia chương trình trao đổi hay không phụ thuộc phần nhiều vào công tác truyền thông, nỗ lực của từng trường trong giải quyết những thủ tục sau tiếp nhận sinh viên và công nhận kết quả học tập”.\nXem thêm tại: ']","['Tất cả, 23', 'Thích, 20', 'Yêu thích, 3']",[],99557,"Thứ Sáu, 26 Tháng 1, 2024 lúc 11:24"
"[""[TRẢI NGHIỆM MÔI TRƯỜNG HỌC TẬP QUỐC TẾ TẠI DUE]\n Những năm qua, hoạt động trao đổi giảng viên và sinh viên từng bước góp phần xu hướng hội nhập của Nhà trường trong bối cảnh toàn cầu hóa. Trên cơ sở các văn bản đã ký kết với đối tác, Trường Đại học Kinh tế - ĐHĐN đã tiếp nhận và chuyển tiếp hàng trăm sinh viên đến thực tập và học trao đổi ngắn hạn tại trường và tại các trường đối tác. Nhiều giảng viên nước ngoài cũng đến Trường giảng dạy, nghiên cứu và tổ chức nhiều hoạt động học thuật khác; góp phần từng bước tạo dựng môi trường giáo dục đa văn hóa.\n Hiện tại, Trường Đại học Kinh tế - ĐHĐN đón tiếp 6 sinh viên quốc tế đến học tập tại DUE theo chương trình trao đổi và đào tạo chính quy với các ngành: Quản trị tài chính, Kinh doanh quốc tế, Marketing. Bên cạnh đó, Trường Đại học Kinh tế còn liên kết với nhiều công ty, đơn vị tổ chức các hoạt động hướng nghiệp để sinh viên quốc tế được nhiều trải nghiệm thú vị môi trường học tập tại Việt Nam và đặc biệt tại DUE.\n Theo sinh viên Esteban (Trường Đại học Côte d’Azur, Cộng hòa Pháp) đã chọn học tập trao đổi tại DUE với ngành Marketing cho biết: “Tôi đến từ Pháp và tôi chưa đi du lịch nhiều.Trường đại học của tôi ở Pháp cung cấp chương trình trao đổi sang Canada, Croatia hoặc đơn giản là bất kỳ nơi nào ở Châu Âu. Nhưng tôi chọn Việt Nam để trải nghiệm về văn hóa thực sự, vì châu Âu vẫn có môi trường khá giống nhau giữa các quốc gia. Tôi cũng luôn yêu thích văn hóa châu Á, đặc biệt là ẩm thực, kiến trúc, cảnh quan và lịch sử của Việt Nam. Trải nghiệm của tôi khi là sinh viên tại DUE thật tuyệt vời. Tôi đang giới thiệu DUE cho những người bạn Pháp của mình và ngày càng nhiều sinh viên từ Đại học Nice Côte d'Azur ở Pháp sẽ tận dụng môi trường sống và học tập đặc biệt này”.\n Sinh viên Cho Hanbe (lớp 46K01.1, khoa Kinh doanh quốc tế) chia sẻ lý do lựa chọn DUE: “Vào năm lớp 12, mình đã tham khảo nhiều ý kiến từ những người thân như các giáo viên và bạn bè, mình nhận được đánh giá cao về Trường Đại học Kinh tế - ĐHĐN. Đây là một trong những trường đại học có danh tiếng về chất lượng giảng dạy và nghiên cứu trong lĩnh vực kinh tế ở miền Trung”.\n Trường Đại học Kinh tế luôn chú trọng việc tạo dựng một môi trường học tập thân thiện, sinh viên tích cực. Sinh viên được khuyến khích tham gia các hoạt động ngoại khóa để nâng cao kỹ năng mềm và trở nên năng động, tự tin hơn. Các lễ hội, cắm trại, biểu diễn ca nhạc, trò chơi thể thao hay tham gia các hoạt động tình nguyện, từ thiện được diễn ra quanh năm. Ngoài ra, nhà trường còn có nhiều câu lạc bộ do sinh viên điều hành. Hệ sinh thái giáo dục của nhà trường đã được xây dựng và mở rộng qua nhiều thập kỷ. Thành tích trong quá khứ của nhà trường là nền tảng cho sự thành công tiếp nối trong tương lai, hướng đến trở thành một cơ sở giáo dục đại học đạt chuẩn quốc tế.\nXem thêm tại: http://due.udn.vn/.../tintuc/tintucchitiet/id/18505/bid/455\n#DUE #sinhvien #quocte #traodoi""]","['Tất cả, 57', 'Thích, 46', 'Yêu thích, 11']",[],101293,"Thứ Năm, 25 Tháng 1, 2024 lúc 19:53"
"['[DUE VÀ LPBANK KÝ KẾT THỎA THUẬN HỢP TÁC, PHÁT HUY THẾ MẠNH TRÊN NHIỀU LĨNH VỰC]\n️\nChiều ngày 25/1, Trường Đại học Kinh tế - ĐHĐN và Ngân hàng Bưu điện Liên Việt (LPBANK) đã diễn ra Lễ ký kết thỏa thuận hợp tác nhằm phát huy thế mạnh của hai bên, tăng cường hợp tác trong lĩnh vực đào tạo, nghiên cứu khoa học và các hoạt động hỗ trợ sinh viên, phục vụ sự nghiệp phát triển nguồn nhân lực trong lĩnh vực ngân hàng.\nVới mong muốn đồng hành cùng Nhà trường trong hành trình hỗ trợ các tài năng trẻ, đào tạo nguồn nhân lực kế cận chất lượng cao cho nước nhà, LPBank trao 10 suất học bổng với tổng giá trị 50 triệu đồng dành cho các em sinh viên vượt khó vươn lên, đạt được thành tích xuất sắc trong học tập. \nCùng ngày, LPBank đã phối hợp với Khoa Ngân hàng tổ chức Chương trình “Chọn nghề - Lập nghiệp cùng LPBank” nhằm mang tới cho các bạn sinh viên những kiến thức, kinh nghiệm và cơ hội để thực tập, làm việc tại tổ chức tài chính lớn, là hành trang để các bạn sinh viên vững bước trong tương lai.\nChi tiết bài viết xem thêm tại link: http://due.udn.vn/.../tintuc/tintucchitiet/id/18518/bid/455\n#DUE, #LPBANK, #Kyket, #Hoptac, #Taichinh, #nganhang', 'Viết bình luận...']","['Tất cả, 72', 'Thích, 64', 'Yêu thích, 8']",[],102970,"Thứ Năm, 25 Tháng 1, 2024 lúc 18:44"
