content,emoji,comment,current,time
"[' Chúc mừng Ngày Quốc tế Phụ nữ 8/3! \n Phòng Công tác sinh viên thân gửi những lời chúc tốt đẹp nhất tới các cô, các bạn nữ sinh của trường Đại học Kinh tế - ĐHĐN, và đặc biệt gửi đến những người phụ nữ tuyệt vời của Phòng CTSV.']","['Tất cả, 12', 'Thích, 8', 'Yêu thích, 3', 'Thương thương, 1']",[],742,"Thứ Sáu, 8 Tháng 3, 2024 lúc 08:03"
"['𝐂𝐇𝐔̛𝐎̛𝐍𝐆 𝐓𝐑𝐈̀𝐍𝐇 𝐓𝐑𝐀̉𝐈 𝐍𝐆𝐇𝐈𝐄̣̂𝐌 𝟏𝟐 𝐓𝐇𝐀́𝐍𝐆 𝐓𝐀̣𝐈 𝐍𝐇𝐀̣̂𝐓 𝐁𝐀̉𝐍 𝐕𝐎̛́𝐈 𝐂𝐇𝐈 𝐏𝐇𝐈́ 𝟎 Đ𝐎̂̀𝐍𝐆\nNhằm tạo điều kiện cho các bạn sinh viên có cơ hội học tập và làm việc tại Nhật Bản, công ty Hải Phong đem đến chương trình trải nghiệm làm việc trong vòng 12 tháng tại xứ sở hoa anh đào hoàn toàn miễn phí.\nNhững lợi ích khi tham gia chương trình:\n Đ𝐮̛𝐨̛̣𝐜 𝐜𝐚̂́𝐩 𝐜𝐡𝐮̛́𝐧𝐠 𝐜𝐡𝐢̉ 𝐐𝐮𝐨̂́𝐜 𝐭𝐞̂́ 𝐬𝐚𝐮 𝐤𝐡𝐢 𝐤𝐞̂́𝐭 𝐭𝐡𝐮́𝐜 𝟏𝟐 𝐭𝐡𝐚́𝐧𝐠. \n 𝐂𝐡𝐮𝐲𝐞̂̉𝐧 đ𝐨̂̉𝐢 𝐯𝐢𝐬𝐚 𝐥𝐚̂𝐮 𝐝𝐚̀𝐢 𝐭𝐮𝐲̀ 𝐭𝐡𝐞𝐨 𝐧𝐠𝐮𝐲𝐞̣̂𝐧 𝐯𝐨̣𝐧𝐠. \n 𝐓𝐢́𝐜𝐡 𝐥𝐮𝐲̃ 𝐭𝐚̀𝐢 𝐜𝐡𝐢́𝐧𝐡 𝟐𝟎𝟎-𝟐𝟓𝟎 𝐭𝐫𝐢𝐞̣̂𝐮/ 𝐧𝐚̆𝐦\n 𝐍𝐚̂𝐧𝐠 𝐜𝐚̂́𝐩 𝐭𝐫𝐢̀𝐧𝐡 đ𝐨̣̂ 𝐭𝐢𝐞̂́𝐧𝐠 𝐍𝐡𝐚̣̂𝐭 𝐍𝟑, 𝐍𝟐, 𝐍𝟏\n Đ𝐮̛𝐨̛̣𝐜 𝐡𝐮̛𝐨̛̉𝐧𝐠 𝐜𝐡𝐞̂́ đ𝐨̣̂ 𝐥𝐮̛𝐨̛𝐧𝐠 𝐭𝐡𝐮̛𝐨̛̉𝐧𝐠 𝐜𝐮̉𝐚 𝐜𝐨̂𝐧𝐠 𝐭𝐲 𝐯𝐚̀ 𝐜𝐚́𝐜 𝐜𝐡𝐞̂́ đ𝐨̣̂ đ𝐨́𝐧𝐠 𝐭𝐡𝐮𝐞̂́, 𝐛𝐚̉𝐨 𝐡𝐢𝐞̂̉𝐦 𝐭𝐡𝐞𝐨 𝐪𝐮𝐲 đ𝐢̣𝐧𝐡 𝐜𝐮̉𝐚 𝐩𝐡𝐚́𝐩 𝐥𝐮𝐚̣̂𝐭 𝐍𝐡𝐚̣̂𝐭 𝐁𝐚̉𝐧\n 𝐘𝐞̂𝐮 𝐜𝐚̂̀𝐮: \n- Sinh viên năm cuối hoặc đã tốt nghiệp ra trường tất cả các chuyên ngành. \n- Độ tuổi từ 20 đến 28 tuổi. \n- Yêu thích văn hoá Nhật bản và có khả năng tiếp thu ngoại ngữ. \n 𝐓𝐡𝐨̛̀𝐢 𝐠𝐢𝐚𝐧 𝐧𝐡𝐚̣̂𝐧 𝐡𝐨̂̀ 𝐬𝐨̛: từ 6/3/2024 - 15/3/2024\n Hotline:  0985-670-755\n Link đăng tư vấn: https://forms.gle/gnffXEFcU4DLWc1g8\n Văn phòng Hải Phong tại Đà Nẵng: 45 Dũng Sĩ Thanh Khê, Đà Nẵng']","['Tất cả, 19', 'Thích, 9', 'Yêu thích, 8', 'Thương thương, 2']",[],1427,"Thứ Tư, 6 Tháng 3, 2024 lúc 16:28"
"['TRUNG TÂM MẠNG LƯỚI MOBIFONE MIỀN TRUNG TUYỂN DỤNG    \nChuyên viên đào tạo, truyền thông làm việc tại Đà Nẵng\n Ứng tuyển ngay: Nộp hồ sơ online qua email tuyendung.mlmt@mobifone.vn và cập nhật thông tin cá nhân tại https://bit.ly/TTMLMT_Tuyendung_Daotao_Truyenthong_Thang3...\nHạn cuối nhận hồ sơ: Đến hết ngày 20/3/2024.   \nThời gian thi tuyển dự kiến: Tháng 3/2024 tại Đà Nẵng.\n Thông tin liên hệ: Bộ phận Nhân sự, Phòng Tổ chức - Hành chính, Trung tâm mạng lưới MobiFone miền Trung, địa chỉ: Đường số 2, KCN Đà Nẵng, P. An Hải Bắc, Q. Sơn Trà, Tp Đà Nẵng. Điện thoại: 02363 932 977']","['Thích, 11']",[],2650,"Thứ Sáu, 1 Tháng 3, 2024 lúc 14:45"
"['CÔNG TY HẢI PHONG THÔNG BÁO CHÍNH SÁCH HỖ TRỢ PHÍ CHO SINH VIÊN TRƯỜNG ĐẠI HỌC KINH TẾ - ĐHĐN ĐĂNG KÝ THAM GIA LÀM VIỆC TẠI NHẬT BẢN THÁNG 02/2024\n=========\nNhằm giúp sinh viên có cơ hội trải nghiệm thực tế tại môi trường doanh nghiệp của Nhật Bản, nâng cao kỹ năng và phát triển sự nghiệp, Công ty Hải Phong gửi đến các bạn sinh viên chính sách hỗ trợ đăng ký tham gia làm việc tại Nhật Bản tháng 02/2024 (xem chi tiết ở file đính kèm) \n1. Sinh viên đăng ký theo đường link để được tư vấn (đính kèm trong comment).\n2. Thời hạn đăng ký xét tuyển đến ngày 29/02/2024 \nThông tin liên hệ: 098 567 0755 \nVăn phòng Hải Phong đại diện tại Đà Nẵng: 45  Dũng Sĩ Thanh Khê, TP Đà Nẵng.']","['Tất cả, 19', 'Thích, 13', 'Yêu thích, 4', 'Thương thương, 2']",[],3622,"Thứ Sáu, 23 Tháng 2, 2024 lúc 14:21"
"['Vietlink Education Vietnam\n  ·', ' Vietlink Education Việt Nam quay trở lại làm việc sau kỳ nghỉ tết nguyên đán Giáp Thìn 2024 \n Đầu năm khai xuân mở chữ, cung chúc mọi người sức khỏe, niềm vui và nhiều thành tựu! Kính đón chào các Quý đối tác, các Quý phụ huynh và các em học sinh quan tâm đến các học bổng và chương trình du học của công ty. \n Vietlink Education được hỗ trợ bởi đội ngũ có chuyên môn giáo dục cao đến từ các trường đại học uy tín trong cả nước. Chúng tôi định vị bản thân là chuyên gia trong lĩnh vực săn học bổng và hơn hết là người bạn đồng hành uy tín của các em học sinh trên bước đường chinh phục các tầng cao trí thức. Thân thiện – bền vững – đáng tin cậy là ba tiêu chí làm nên phong cách làm việc của đội ngũ Vietlink. Chỉ cần bạn có ước mơ – hãy để Vietlink chắp cánh cùng bạn!\n Vietlink education – Wings fly high! \n𝗗𝗨 𝗛𝗢̣𝗖 𝗩𝗜𝗘𝗧𝗟𝗜𝗡𝗞 𝗘𝗗𝗨𝗖𝗔𝗧𝗜𝗢𝗡\nTư vấn Miễn Phí\n 23 Xuân Tâm, Quận Hải Châu, Đà Nẵng\n0236 3990088 - Hotline: 0919.798.809\nZalo/viber: 0919.798.809\n#Duhoc, #tuvanduhoc, #Vietlinkeducation, #Hocbongtoanphan']",[],[],4959,"Thứ bảy, 17 Tháng 2, 2024 lúc 22:44"
[],"['Thích, 4']",[],6068,"Thứ Tư, 3 Tháng 1, 2024 lúc 12:17"
"['HỌC BỔNG TOÀN PHẦN TẠI HUNG-GA-RI 2024\nTheo thông báo từ Bộ GD&ĐT Việt Nam, Chính phủ Hung-ga-ri cấp tối đa 200 học bổng cho công dân Việt Nam đi đào tạo tại Hung-ga-ri theo trình độ đại học (cử nhân), thạc sĩ liên thông từđại học(OTM), thạc sĩ (MA/MSc) và tiến sĩ.\n***Thời gian đào tạo\n- Chương trình đại học: từ 03 năm đến 04 năm học\n- Chương trình thạc sĩ: từ 1,5 năm đến 02 năm học\n- Chương trình thạc sĩ liên thông từ đại học: 05 năm đến 06 năm học.\n***Quyền lợi học bổng:\n- Miễn học phí\n- Miễn bảo hiểm\n- Được sắp xếp ở ktx\n- Hàng tháng nhận trợ cấp sinh hoạt\n- Miễn vé máy bay khứ hồi.\n***Điều kiện học bổng:\n- Đối với bậc đại học:\n- Sinh viên năm thứ nhất của các đại học, học viện, trường đại học Việt Nam (hệ chính quy tập trung) có kết quả 03 năm học THPT và học kỳ I năm thứ nhất đại học đạt từ 7,0 trở lên\n- Học sinh đang học lớp 12 đã đoạt giải tại các kỳ thi quốc tế, quốc gia, có kết quả học tập ở bậc THPT đến hết học kỳ I lớp 12 đạt từ 7.0 trở lên\n- Đối với bậc thạc sĩ:\n- Sinh viên tốt nghiệp đại học với kết quả học tập đạt loại giỏi trở lên\n- Người tốt nghiệp đại học, đang công tác tại các cơ quan nhà nước, các cơ sở giáo dục\n***Vì sao chọn Hungary: \n- Thuộc liên minh châu âu và khu vực Schengen, sinh viên được đi lại tự do giữa các nước trong khu vực này\n- Chi phí sinh hoạt thấphơn so với các nước khác trong châu Âu\n- Bằng cấp được công nhận trên toàn thế giới\n- Sinh viên được phép đi làm thêm trong khi học tại Hung-ga-ri\n***Ngôn ngữ học tập: tiếng Anh và tiếng Hung-ga-ry\n- Nếu chọn học bằng chương trình tiếng Anh, yêu cầu ielts > 5.5\n- Nếu không có chứng chỉ tiếng anh sẽ được học dự bị 1 năm tiếng Hung-ga-ri ( học phí khoá tiếng này sẽ được miễn phí).\n𝗗𝗨 𝗛𝗢̣𝗖 𝗩𝗜𝗘𝗧𝗟𝗜𝗡𝗞 𝗘𝗗𝗨𝗖𝗔𝗧𝗜𝗢𝗡\n                Tư vấn Miễn Phí: https://s.net.vn/RXFR\n                  23 Xuân Tâm, Quận Hải Châu, Đà Nẵng\n                  0236 3990088 - Hotline: 0919.798.809\n                  Zalo/viber: 0919.798.809\n#Duhoc, #tuvanduhoc, #vietlink, #Hocbongtoanphan']","['Thích, 2']",[],6965,"Thứ Năm, 28 Tháng 12, 2023 lúc 09:28"
"['C ÔNG TY TNHH MURATA MANUFACTURING VIỆT NAM \n=====\nTHÔNG BÁO TUYỂN DỤNG \nCông ty TNHH Murata Manufacturing là công ty 100% vốn đầu tư nước ngoài, được đầu tư bởi Tập đoàn Murata Nhật Bản, chuyên sản xuất các linh kiện điện tử phục vụ cho các khách hàng lớn trong lĩnh vực công nghệ. \nChúng tôi cần tuyển dụng vị trí thực tập sinh\nThực tập sinh Bộ phận Tài vụ ( Kế toán)\n\uf076 Số lượng: 02 người\n\uf076 Yêu cầu\n-  Sinh viên chuyên ngành kế toán có kế hoạch thực tập tốt nghiệp \n- Thành thạo tin học văn phòng\n- Tiếng Anh tốt là một lợi thế\nQUYỀN LỢI:\n\uf076 Được tham gia vào các hoạt động, công việc của Bộ phận Tài vụ\n\uf076 Được cung cấp các dụng cụ để thực tập: máy tính, email,…\n\uf076 Được cấp phát đồng phục khi đi thực tập, hỗ trợ cơm trưa\n\uf076 Được nhận phụ cấp khi đi thực tập\n\uf076 Được hỗ trợ cung cấp tài liệu, thông tin khi làm báo cáo \nNộp CV qua email: thi_hien.ly@murata.com \nĐịa chỉ: Lô A1, đường số 2, KCN Hòa Khánh, phường Hòa Khánh Bắc, Liên Chiểu, Đà Nẵng\nSố điện thoại: 0236 3 736 188']","['Tất cả, 6', 'Thích, 5', 'Thương thương, 1']",[],8517,"Thứ Tư, 13 Tháng 12, 2023 lúc 09:52"
